category,datetime,headline,id,image,related,source,summary,url
company,1706024684,Nvidia And AMD Are Overhyped And Overvalued,125259506,https://static.seekingalpha.com/cdn/s3/uploads/getty_images/1494623399/image_1494623399.jpg?io=getty-c-w1536,AMD,SeekingAlpha,"There is high demand for Nvidia and AMD GPUs in the AI training market, driven by tech giants. But can it last? Click for our view of NVDA and AMD stock prospects.",https://finnhub.io/api/news?id=1787e3eda19d88d08982dfd74c6b5d419db204bc465b7994fb40d7055d0a39ae
company,1706022031,Advanced Micro Devices (AMD) Reports Next Week: Wall Street Expects Earnings Growth,125255342,https://media.zenfs.com/en/zacks.com/7ea641b46fe75c0a913349e5e610d6a2,AMD,Yahoo,Advanced Micro (AMD) doesn't possess the right combination of the two key ingredients for a likely earnings beat in its upcoming report. Get prepared with the key expectations.,https://finnhub.io/api/news?id=0799c106650a60d0b2586d8fa5a1f17ca8e21cf971b5b43c0728cadfc4270a70
company,1706013000,Will Micron Be a Trillion-Dollar Stock by 2035?,125246825,https://g.foolcdn.com/editorial/images/761844/engineer-monitors-chip-performance.jpg,AMD,Yahoo,AI chip stocks are on a tear amid investor optimism.,https://finnhub.io/api/news?id=55088d496b2f3161d6a1a3bf8fc0073b76e70f8a248a65fb2ccd38e8dc4bcd78
company,1706011920,Wedbush: INTC and AMD to Benefit from PC Recovery,125287233,,AMD,TipRanks,Looking for stock market analysis and research with proves results? Zacks.com offers in-depth financial research with over 30years of proven results.,https://finnhub.io/api/news?id=0e1cec939ca736325c2f581e776625dfffa2019f137bb409991768eef1a308f5
company,1706011560,"Nvidia Will Lead 2024 Double-Digit Semiconductor Stock Rally, Analysts Say",125262297,,AMD,Benzinga,Looking for stock market analysis and research with proves results? Zacks.com offers in-depth financial research with over 30years of proven results.,https://finnhub.io/api/news?id=4c76fe74bff6aaf96d9bbe00540e70a2519ad8054840018e0fbad496f7df078f
company,1706011320,Two Chip Stocks in Line for Gains With PC Recovery,125287239,,AMD,TipRanks,Looking for stock market analysis and research with proves results? Zacks.com offers in-depth financial research with over 30years of proven results.,https://finnhub.io/api/news?id=9f38d92af0bfccc9df3a1026992a572f9edafff14de1e099f79ca010192a8c88
company,1706010753,AMD Q4 Earnings Preview: 2.5/3D Chips Are Big For AI,125251120,https://media.gettyimages.com/id/1828906553/photo/lisa-su-chair-and-chief-executive-officer-of-advanced-micro-devices-inc-during-the-amd.jpg?b=1&s=594x594&w=0&k=20&c=gvt1sor6dsf8GpRUtU9XzIDp0SxzJlyE8ahrLSbxyGk=,AMD,SeekingAlpha,"Advanced Micro Devices, Inc.'s new 2.5/3D AI chips could revolutionize data centers and propel AMD to lead the AI chip sector. Click for my AMD Q4 earnings preview.",https://finnhub.io/api/news?id=4dbd38f886ad4057fdc0ae4ebf7138bf0da6224bd01766d639f64ecd938809b0
company,1706010660,3 Retirement Stocks to Buy and Hold Forever: January 2024,125274105,,AMD,InvestorPlace,Looking for stock market analysis and research with proves results? Zacks.com offers in-depth financial research with over 30years of proven results.,https://finnhub.io/api/news?id=5a5ccc7df72f038a07e70a513f1eee6893f50cde348d33b86529c94b3f569f02
company,1706010000,"QQQ ETF Update, 1/24/2024",125276647,,AMD,TipRanks,Looking for stock market analysis and research with proves results? Zacks.com offers in-depth financial research with over 30years of proven results.,https://finnhub.io/api/news?id=f89f41342c87d9da94b263f964eccca0af077d6e0d216473c8e3bdd5e923e065
company,1706007180,"Nvidia initiated, Tractor Supply downgraded: Wall Street's top analyst calls",125255220,,AMD,Thefly.com,Looking for stock market analysis and research with proves results? Zacks.com offers in-depth financial research with over 30years of proven results.,https://finnhub.io/api/news?id=583b81e36008cd7cfe090e7fee1a5224a1161936688f08699f125e00dde0fb88
company,1706006820,5 Surging Growth Stocks to Buy for 2024,125251063,,AMD,InvestorPlace,Looking for stock market analysis and research with proves results? Zacks.com offers in-depth financial research with over 30years of proven results.,https://finnhub.io/api/news?id=d3dadc1b8667e97efcb78f2ee6ce2f4a324c01b28433d34991ae9ab7f6fa2124
company,1706006220,"Intel, AMD appear poised to benefit from higher PC demand: Wedbush",125287247,,AMD,Seeking Alpha,Looking for stock market analysis and research with proves results? Zacks.com offers in-depth financial research with over 30years of proven results.,https://finnhub.io/api/news?id=ce3956f91fa438fbf0d99d7ae4c121d36b33dd56c98879c49faf15524dde9bb2
company,1706005754,5 Reasons Why This Bull Market Looks To Be Promising,125249453,https://media.gettyimages.com/id/90499089/photo/bull-and-a-rising-stock-chart.jpg?b=1&s=170667a&w=0&k=20&c=iFqyqb5Ql92u-yFR5EJHfIvFGt2nHIyn7YgiLmKeovE=,AMD,SeekingAlpha,The market-cap weighted S&P 500 has reached new all-time highs. Find out the reasons why this bull market looks to be promising.,https://finnhub.io/api/news?id=41702b96dee294e5d74e5f52c8f43eacdf63a8995d4c2e81f00d385eb1b67bbb
company,1706004600,The Next Nvidia? 2024 Will Be a Make-or-Break Year for AMD.,125242586,https://g.foolcdn.com/editorial/images/761925/gettyimages-1433587895.jpg,AMD,Yahoo,Can Advanced Micro Devices catch its larger rival in the AI chip market?,https://finnhub.io/api/news?id=9b021961d0cc7e41a308137e0437e7ba0219503d65ea8cde9d9fc975c2c00b61
company,1706004000,Uniswap leads way as large cryptocurrencies decrease,125265905,https://images.mktw.net/im-397587/social,AMD,MarketWatch,"All large cryptocurrencies were down during morning trading on Tuesday, with Uniswap seeing the biggest change, dropping 7.32% to $5.62. Ethereum declined...",https://finnhub.io/api/news?id=83a006ddd5bad309e48eec91b53541257f2df9837e27ef8595c141fb4914121b
company,1705999800,"Nvidia, Western Digital among top picks at Cantor for 2024",125251065,,AMD,Seeking Alpha,Looking for stock market analysis and research with proves results? Zacks.com offers in-depth financial research with over 30years of proven results.,https://finnhub.io/api/news?id=944dca328ad4cd78d49a6ab5088daf315d5974c5e2fbda38d235d27a5bc84c3d
company,1705998600,AMD: Time To Tune Out The AI Hype Media Frenzy (Rating Downgrade),125246716,https://media.gettyimages.com/id/1828906553/photo/lisa-su-chair-and-chief-executive-officer-of-advanced-micro-devices-inc-during-the-amd.jpg?b=1&s=594x594&w=0&k=20&c=gvt1sor6dsf8GpRUtU9XzIDp0SxzJlyE8ahrLSbxyGk=,AMD,SeekingAlpha,"AMD has reached all-time highs, outperforming the S&P 500, corroborating my previous bullish thesis. See why I downgrade AMD stock from buy to hold.",https://finnhub.io/api/news?id=eb2796f15fcfad257c99466af82120b6d7ea6728aa70293d5567cd990adb3bf7
company,1705996500,Here’s what big consumer-sentiment gains mean for the stock market — and this one is unusual,125247231,,AMD,MarketWatch,Looking for stock market analysis and research with proves results? Zacks.com offers in-depth financial research with over 30years of proven results.,https://finnhub.io/api/news?id=2732d1f318f88eafffdd281dc8e32851ed5d4c823c52d8d3107313d47e08ad34
company,1705996500,Notable open interest changes for January 23rd,125248462,,AMD,Thefly.com,Looking for stock market analysis and research with proves results? Zacks.com offers in-depth financial research with over 30years of proven results.,https://finnhub.io/api/news?id=4ff14747b84fe61968190ee470e2d64a9d49d2f9485496ac3fe23b0fa42df1c2
company,1705990860,Tuesday Talk: Spiking,125248465,,AMD,TalkMarkets,Looking for stock market analysis and research with proves results? Zacks.com offers in-depth financial research with over 30years of proven results.,https://finnhub.io/api/news?id=f8b21dceae174da581c7c002356facc4db23a1540aefccb67a0975a4ed63efa2
company,1705990320,Here’s what ‘vibecession’ endings usually mean for the stock market. This one is unusual anyway.,125247232,,AMD,MarketWatch,Looking for stock market analysis and research with proves results? Zacks.com offers in-depth financial research with over 30years of proven results.,https://finnhub.io/api/news?id=96cc2183b3cfe56801385c20b5df163415e4fc0a1335caa8e0cee99ca7f0303c
company,1705990080,"Earnings Season Buzz: Netflix Soars, Texas Instruments Stumbles",125303490,,AMD,TalkMarkets,Looking for stock market analysis and research with proves results? Zacks.com offers in-depth financial research with over 30years of proven results.,https://finnhub.io/api/news?id=e6f99f0153bff49f296fb0437dec76f0369e3a928dd31a1fdcfc2db48c34e74e
company,1705988280,"Cathie Wood's Ark Invest Bucks Trend, Trims 2 Major Chip Stocks Ahead Of Q4 Results: Profit-Taking Or Portfolio Shift?",125248467,,AMD,Benzinga,Looking for stock market analysis and research with proves results? Zacks.com offers in-depth financial research with over 30years of proven results.,https://finnhub.io/api/news?id=adc5014e5bbe47a987022f120cdf312d889170b51b156e8a0594bf2c055d92ae
company,1705987560,New Street upgrades AMD on AI chip spending growth,125300250,,AMD,Thefly.com,Looking for stock market analysis and research with proves results? Zacks.com offers in-depth financial research with over 30years of proven results.,https://finnhub.io/api/news?id=05f74268573208d326854d05199b913cf2b2961da8a06529f8029b554f84d31b
company,1705986480,Riding the Nvidia Rocket: Time to Cash Out or Stay Aboard NVDA Stock?,125248468,,AMD,InvestorPlace,Looking for stock market analysis and research with proves results? Zacks.com offers in-depth financial research with over 30years of proven results.,https://finnhub.io/api/news?id=993718adf98c225e48d5ccd422571054f509d8a17bc0b2f9488c721a412eae2c
company,1705986180,"If You Can Only Buy One Quantum Computing Stock in January, It Better Be One of These 3 Names",125247508,,AMD,InvestorPlace,Looking for stock market analysis and research with proves results? Zacks.com offers in-depth financial research with over 30years of proven results.,https://finnhub.io/api/news?id=9110d41df4a63369f47095a653bfcf9bf8acbfe1a9536fcbb19975e548bd5097
company,1705986180,Why AMD Is An Unstoppable Growth Stock,125242919,,AMD,InvestorPlace,Looking for stock market analysis and research with proves results? Zacks.com offers in-depth financial research with over 30years of proven results.,https://finnhub.io/api/news?id=fcc6c186b43217126f2e50463a434e44cbc51ad32fb2f4d4b1918a746c2f16bf
company,1705978380,BUZZ Investing: Echoes Of 'Mission Accomplished' Amid Inflation Battle,125238843,https://media.gettyimages.com/id/1437248680/photo/stock-market-trading-monitor-background.jpg?b=1&s=170667a&w=0&k=20&c=84PCZp_7yXfiRo_pR-cyeWBxg-eL7T_Sd8DTQa23-7Q=,AMD,SeekingAlpha,"U.S. stock markets ended the year strong after the Fed held interest rates steady, prompting revised expectations and signaling lower interest rates in 2024.",https://finnhub.io/api/news?id=aa81889bc2058b0630298d9d025c49be9380cb42f45110f6b88aadf157c3f090
company,1705975740,"After 130% Surge, AMD Faces Uncertain Road Ahead: Top Analyst Says Chipmaker's Future Shrouded In Doubt",125248471,,AMD,Benzinga,Looking for stock market analysis and research with proves results? Zacks.com offers in-depth financial research with over 30years of proven results.,https://finnhub.io/api/news?id=7d56cc729cc46141f567e52697106b9b50a62bcfda009a57fc0946cc6383c938
company,1706130188,"Why AMD, Applied Materials, and Super Micro Computer Popped Wednesday",125296111,https://g.foolcdn.com/editorial/images/762563/semiconductor-computer-chip-with-the-letters-ai-in-the-middle.jpg,AMD,Yahoo,Investors could be looking at a win-win-win scenario in AI stocks.,https://finnhub.io/api/news?id=619315c3d57e0e93e4c77480d2b9fc49398ff0159e503410660163ffbb525095
company,1706126061,Growing Credit Card Debt Suggests U.S. Consumers Are Close To Capitulating,125283743,https://static.seekingalpha.com/cdn/s3/uploads/getty_images/1471709502/image_1471709502.jpg?io=getty-c-w1536,AMD,SeekingAlpha,"Concerns grow as consumer credit card debt rises sharply, impacting household incomes. Read an analysis of the macroeconomic environment here.",https://finnhub.io/api/news?id=c6492d8ae730a32fc8d036d4ba31a2d8efc955c2f7dd728c0fc5bf320c1572f4
company,1706123578,Why Is AMD (AMD) Stock Soaring Today,125296228,https://s.yimg.com/ny/api/res/1.2/CF_jp.YgwUr5daOVP6AyYg--/YXBwaWQ9aGlnaGxhbmRlcjt3PTEyMDA7aD02MDA-/https://media.zenfs.com/en/stockstory_922/d8e71fcf83a5154bb9a363113758de33,AMD,Yahoo,"Shares of computer processor maker AMD (NASDAQ:AMD) jumped 5.6% in the morning session after NewStreet Research analyst Pierre Ferragu upgraded the stock's rating from Neutral to Buy and assigned a price target of $215. The price target represents a potential 20% upside from where shares traded when the upgrade was announced. The analyst added, ""AMD is the best way to play datacenter AI chips if the company's forecast of a $400 billion addressable market by 2027 bears out."" As a reminder, on Dec",https://finnhub.io/api/news?id=b91e5c45ee23c6138dd489d6790738928b0ad874f14af492789cb821bda19c68
company,1706118960,Tech Up as Traders Chase AI Gains -- Tech Roundup,125289519,https://mw3.wsj.net/mw5/content/logos/mw_logo_social.png,AMD,MarketWatch,Shares of technology companies rose as traders continued to chase gains in artificial-intelligence concerns. Shares of Advanced Micro Devices rose by almost...,https://finnhub.io/api/news?id=8b1fd162602bf897d311657358292d6e7b299d4166af222fd259fdca7d373525
company,1706116540,"Microsoft, Nvidia among companies to profit the most from AI",125275941,https://s.yimg.com/ny/api/res/1.2/AZD4Lv69CTxViFPkSbdKRw--/YXBwaWQ9aGlnaGxhbmRlcjt3PTEyMDA7aD02NzY-/https://s.yimg.com/os/creatr-uploaded-images/2024-01/5aa29970-bad5-11ee-b75d-e2752d67af9e,AMD,Yahoo,"As part of Yahoo Finance's AI Revolution special coverage this week, Tech Editor Dan Howley explores the industries and companies positioned to capitalize on the generative AI boom ahead. While hype builds around futuristic AI applications, Howley spotlights areas where monetization potential already exists: Automotive, Healthcare, and Agriculture. Howley cites leaders like Microsoft (MSFT), whose Copilot program drives enterprise AI adoption, and Nvidia (NVDA), which powers advanced AI computing through its dominance of AI chip manufacturing. To continue watching more of Yahoo Finance's AI Revolution special click here, or you can watch this full episode of Yahoo Finance Live here. Editor's note: This article was written by Angel Smith.",https://finnhub.io/api/news?id=b1692726b3e52c13f3c0be8ceb4913c2a470726c48a4ee8f3d416b1a651a71fc
company,1706116500,AMD Gets Another Upgrade. Why an Analyst Says the Stock Could Quadruple.,125296233,,AMD,Yahoo,"Advanced Micro Devices shares have spiked 20% since the start of the year, amid a surge of optimism about the outlook for the company’s opportunity in chips used for artificial-intelligence applications.  On Wednesday, AMD shares extended their rally, jumping 5.5%, thanks in part to a wildly upbeat analyst report.  NewStreet Research’s Pierre Ferragu raised his AMD rating to Buy from Hold, with a $215 target price.",https://finnhub.io/api/news?id=83efb7485693800642cf6e221745fd9c60e1a0a52cc294bbce33dd653df351ca
company,1706114220,3 Reasons to Buy Intel Stock in 2024,125297555,https://g.foolcdn.com/editorial/images/762057/smiling-couple-celebrates-good-news-on-the-computer.jpg,AMD,Yahoo,"The company is gearing up to make a big splash in AI, and is profiting from PC market improvements.",https://finnhub.io/api/news?id=67473a8696da510d3bced2b9563d3bdb992cda1918d269c3a20a9e7658c05e50
company,1706114100,Advanced Micro Devices Inc. stock outperforms competitors on strong trading day,125289520,https://images.mktw.net/im-220105/social,AMD,MarketWatch,"Shares of Advanced Micro Devices Inc. advanced 5.86% to $178.29 Wednesday, on what proved to be an all-around mixed trading session for the stock market,...",https://finnhub.io/api/news?id=c76266c97962fbd309f3370d14d290f3061fea65dbb851290097012af0d1528c
company,1706110620,Missed the boat on AMD’s stock surge? Why this analyst says you’re not too late.,125278557,https://images.mktw.net/im-800123/social,AMD,DowJones,"AMD shares have shot up 140% over the past year, but an analyst at New Street Research says there’s still time to jump on the bull train.",https://finnhub.io/api/news?id=c3b659e82f6dde35ee1eceefce13237a8fea33f67c64f98818b8d7494c157153
company,1706108693,"What AMD, Qualcomm, and TSMC Stock Investors Should Know About Recent Artificial Intelligence (AI) Chip Updates",125274059,https://g.foolcdn.com/editorial/images/762469/amd-headquarters-santa-clara-with-amd-logo-on-building_amd_advance.jpg,AMD,Yahoo,"Advanced Micro Devices MI300X are appearing online, ready to combat Nvidia's H100.",https://finnhub.io/api/news?id=1492e7bb41f8e18a766b3bc93e0ebd58e1087d3b5bcabe4eb4b90f67a4ffdac0
company,1706104560,Missed Out on Nvidia? 2 Incredibly Cheap Artificial Intelligence (AI) Stocks to Buy Before They Jump 47% to 95%,125272996,https://g.foolcdn.com/editorial/images/761863/abstract-human-skull-representing-ai.jpg,AMD,Yahoo,"Wall Street expects these two chip stocks to capitalize on AI adoption along with Nvidia, and they are trading at attractive levels right now.",https://finnhub.io/api/news?id=a032f8cc4614efd216f5683325a2ba9cef763e1dd2028c289f15b4d7884e166b
company,1706100300,3 High-Growth Stocks That Could Be Worth $1 Trillion in 10 Years -- or Sooner,125273006,https://g.foolcdn.com/editorial/images/761992/rising-rocket-chart.png,AMD,Yahoo,There's every reason to believe these companies' business models will allow them to reach this lauded size within the coming decade.,https://finnhub.io/api/news?id=45fc938c428735ea8ef823856f6532a0c1487f377f117be1e61136ebc81e2c34
company,1706100300,Forget Nvidia: This Stock Is Poised for a Potential Bull Run in 2024,125273005,https://g.foolcdn.com/editorial/images/762127/artificial-intelligence-investing-algorithms.jpg,AMD,Yahoo,This company is gearing up to challenge Nvidia's position in AI this year.,https://finnhub.io/api/news?id=100e013925c2bb5af65e78db039a9900b7a648c39551ac47bf1998a93c37423b
company,1706096220,"SPY ETF Update, 1/25/2024",125300340,,AMD,TipRanks,Looking for stock market analysis and research with proves results? Zacks.com offers in-depth financial research with over 30years of proven results.,https://finnhub.io/api/news?id=4d520c708d31f8f9574255ca27a9730d02ea2cda6244772b3d9dd4f144d17dd2
company,1706095800,Here's what Wall Street is saying about IBM ahead of earnings,125274954,,AMD,Thefly.com,Looking for stock market analysis and research with proves results? Zacks.com offers in-depth financial research with over 30years of proven results.,https://finnhub.io/api/news?id=5ac29a0dd6509153545e6d86cdd270dcfb05936fa3439b5a5a1d4040dfc1704e
company,1706095283,"AMD: the stock stands out, New Street upgrades to buy",125273764,,AMD,Finnhub,"On Wednesday, AMD posted one of the strongest gains in the S&P 500 index, supported by a recommendation upgrade from analysts at New Street Research, who are now Buy on the stock.The American...",https://finnhub.io/api/news?id=a8a278ef871633510d57e6c8a2c1e5ee70eea43a92e74aa55338ab659c30bfd0
company,1706095200,3 Reasons to Buy Nvidia Stock in 2024,125273009,https://g.foolcdn.com/editorial/images/761457/nvidia-headquarters-outside-with-black-nvidia-sign-with-nvidia-logo.jpg,AMD,Yahoo,"The company's stock skyrocketed in 2023, but it still has plenty of room left to run in the new year.",https://finnhub.io/api/news?id=245939414227f66946f79f7f4f8d4b44a6eb3d4945fb6e166407a07686f25d6b
company,1706094900,3 Semiconductor Stocks to Buy Before the Bulls Rush Back,125274070,https://g.foolcdn.com/editorial/images/762053/silicon-wafer-for-manufacturing-semiconductor-of-integrated-circuit.jpg,AMD,Yahoo,"TSMC, AMD, and Micron are still great long-term investments.",https://finnhub.io/api/news?id=65093daebefe44ef0b4468cffcc1b9ce62e49e2a2d2352dcf76278a934110c5c
company,1706094300,AMD gains as New Street Research upgrades on AI hopes,125275227,,AMD,Seeking Alpha,Looking for stock market analysis and research with proves results? Zacks.com offers in-depth financial research with over 30years of proven results.,https://finnhub.io/api/news?id=a4cde81b4a70f57004369f3988c5dc68601da1d3c6dd15a848d82ec061675d0d
company,1706091000,"Nvidia Dominates the AI Market, but Don't Ignore These 3 Challengers",125271385,https://g.foolcdn.com/editorial/images/762012/nvidia-ceo-jensen-huang-with-geforce-rtx-4090-gpu.png,AMD,Yahoo,Investors shouldn't assume this red-hot chipmaker is invincible.,https://finnhub.io/api/news?id=e636efe6f7b7b3d5d567d4bcb7a9f2ffe47c09570b14fd950717a9abafe29291
company,1706090400,Why Is Phunware (PHUN) Stock Down 12% Today?,125274583,,AMD,InvestorPlace,Looking for stock market analysis and research with proves results? Zacks.com offers in-depth financial research with over 30years of proven results.,https://finnhub.io/api/news?id=7613d51ab443353a5de5b4881eeef50a401f1bc2ade9b75b7444fb65e491ddb8
company,1706090400,"Large cryptocurrencies climb on Solana, Polkadot increases",125286453,https://images.mktw.net/im-397587/social,AMD,MarketWatch,"All large cryptocurrencies were up during morning trading on Wednesday, with Solana seeing the biggest change, rising 5.93% to $85.87. Polkadot climbed 2.83%...",https://finnhub.io/api/news?id=afcd64b1e7f75d9aa0b92b32b78b91e8df7dad1b60f438273793f5f4c72492ac
company,1706089740,SPOT Stock Jumps as Spotify Starts In-App Purchases,125273589,,AMD,InvestorPlace,Looking for stock market analysis and research with proves results? Zacks.com offers in-depth financial research with over 30years of proven results.,https://finnhub.io/api/news?id=1339a7d1cdf35dcd85e0a42b87e792c31ac83ef4a35478cacb9f9ad8b7af88c6
company,1706087880,AMD Stock Pops on Analyst Upgrade,125273591,,AMD,InvestorPlace,Looking for stock market analysis and research with proves results? Zacks.com offers in-depth financial research with over 30years of proven results.,https://finnhub.io/api/news?id=d7b4aa9d38a566bbbff8b7ae67c6e014d63f2feff9a3ad2e27850ebefdeb25c1
company,1706087100,"Netflix upgraded, Tesla initiated: Wall Street's top analyst calls",125274385,,AMD,Thefly.com,Looking for stock market analysis and research with proves results? Zacks.com offers in-depth financial research with over 30years of proven results.,https://finnhub.io/api/news?id=b151695f3e77921740178d06af9afd47e848160a3340d6c55836ecd4f32c2ee3
company,1706082300,"Intel Q4 Earnings Preview: Analysts Cautious For 2024, Envisions 'More-Clouded Picture' After Strong 2023",125276519,,AMD,Benzinga,Looking for stock market analysis and research with proves results? Zacks.com offers in-depth financial research with over 30years of proven results.,https://finnhub.io/api/news?id=ea891802e8479f9463829e7b28339fcd45be7dfab702fa1fc926095cad1e5d17
company,1706074560,Is AMD Stock ‘Too Hot to Touch’ After Latest Surge?,125303444,,AMD,InvestorPlace,Looking for stock market analysis and research with proves results? Zacks.com offers in-depth financial research with over 30years of proven results.,https://finnhub.io/api/news?id=d3e4d69533e6940ecb745d56c6d20c4e5f64681f0264227152ddd0f98fd8987e
company,1706072940,7 Stocks to Sell Before Their Bubble Bursts in 2024,125295689,,AMD,InvestorPlace,Looking for stock market analysis and research with proves results? Zacks.com offers in-depth financial research with over 30years of proven results.,https://finnhub.io/api/news?id=0ade239f106b88166c426c21cad3505a244e104035adb6e0fe05e9a9df7c542a
company,1706072760,What's Chipping Away At This Rally?,125303447,,AMD,TalkMarkets,Looking for stock market analysis and research with proves results? Zacks.com offers in-depth financial research with over 30years of proven results.,https://finnhub.io/api/news?id=bf35e907148482fd9fd904afcdc0142baebd386f89fc57571abd334a65fbe8b0
company,1706072340,"AMD Shares Surge Premarket, Setting Sights On All-Time Highs: What's Powering Rally?",125276527,,AMD,Benzinga,Looking for stock market analysis and research with proves results? Zacks.com offers in-depth financial research with over 30years of proven results.,https://finnhub.io/api/news?id=bf76c47e85368acd6bee2b7fd59cd6e5fa3da71a2999ff6293df845a3cbc9069
company,1706067600,"Tech Giants Nvidia, AMD, IBM, Microsoft, Google Partner With US Government For AI Research Project",125280254,,AMD,Benzinga,Looking for stock market analysis and research with proves results? Zacks.com offers in-depth financial research with over 30years of proven results.,https://finnhub.io/api/news?id=030d40b08f5c006a782f1431015b11ead0b08166c345948b53c63dc5c327cf08
company,1706067480,What You Missed On Wall Street On Wednesday,125279993,,AMD,Thefly.com,Looking for stock market analysis and research with proves results? Zacks.com offers in-depth financial research with over 30years of proven results.,https://finnhub.io/api/news?id=5bdd4528897269e044a679614d4f33662faf7f35fa8e638360bc8fb81678772c
company,1706065825,My Top 3 Stocks For 2024,125270186,https://static.seekingalpha.com/cdn/s3/uploads/getty_images/1325680818/image_1325680818.jpg?io=getty-c-w1536,AMD,SeekingAlpha,Read here for top tech stocks with impressive returns in 2023 and explore promising picks for 2024 in the thriving AI industry for potential investment.,https://finnhub.io/api/news?id=a880f9f7162284eb3fbc3078edbb416fd3e864a965aff8e10217707e4bf9a946
company,1706058300,Semiconductors cheer as ASML says orders more than tripled,125277563,,AMD,Seeking Alpha,Looking for stock market analysis and research with proves results? Zacks.com offers in-depth financial research with over 30years of proven results.,https://finnhub.io/api/news?id=33688e04a90169c90965c50b40d303592cb6bdcd605c4ea444f1b43ca8320379
