category,datetime,headline,id,image,related,source,summary,url
company,1707377220,Arm Stock Soars More Than 50%. It’s Joining the AI Party.,125722075,https://images.barrons.com/im-62344450/social,AMD,MarketWatch,Chip designer Arm Holdings is the latest company to join the circle of designated early winners from investment in artificial intelligence.,https://finnhub.io/api/news?id=1bb7407568985fa301ea976a5fe92eb5dfae4940843730d7a493d24d060cf6d7
company,1707377072,"Insider Sell: EVP Strategic Partnerships Paul Grasby Sells 40,289 Shares of Advanced Micro ...",125647105,https://media.zenfs.com/en/us.finance.gurufocus/d4f054a08d0a715c27f8c066db67365a,AMD,Yahoo,"Paul Grasby, EVP Strategic Partnerships, executed a sale of 40,289 shares of Advanced Micro Devices Inc (NASDAQ:AMD) on February 5, 2024, as reported in the SEC Filing.",https://finnhub.io/api/news?id=91f834142033ef8c8d9c79d18c7fa0b8cc48e29ecbfea9dca68c8a9d73b18f13
company,1707375840,"No Imminent AI Bubble Burst, Says Munster: 'We Are At The Start Of 3-5 Year Tech Run'",125647511,,AMD,Benzinga,Looking for stock market analysis and research with proves results? Zacks.com offers in-depth financial research with over 30years of proven results.,https://finnhub.io/api/news?id=1291de800ea7ed2710000f450d27da4cfe83583e5e77c57991b659901d8fb756
company,1707375540,Thoughts For Thursday: Traders Have A Short Term Grail Quest,125663327,,AMD,TalkMarkets,Looking for stock market analysis and research with proves results? Zacks.com offers in-depth financial research with over 30years of proven results.,https://finnhub.io/api/news?id=9bab84731e07f3a468f704169575c7c5ae6800255c69c3bba9d125ef2718e661
company,1707372300,NVDA Stock Forecast: Will Q4 Earnings Launch Nvidia to $2 Trillion?,125645746,,AMD,InvestorPlace,Looking for stock market analysis and research with proves results? Zacks.com offers in-depth financial research with over 30years of proven results.,https://finnhub.io/api/news?id=dd68498fdc021d9b978d1c4e5c64f83b14d7c9fe3f90e9c50e3a9db8f2f3a368
company,1707372000,These stocks are poised to lead tech beyond the ‘Magnificent Seven’,125675877,,AMD,MarketWatch,Looking for stock market analysis and research with proves results? Zacks.com offers in-depth financial research with over 30years of proven results.,https://finnhub.io/api/news?id=7c1acf65a7b43e987e5753c8b3c19e8f16ff90c5ab692f5e8530c4ad8b236377
company,1707370140,Beyond the Jitters: Expect a Steady Climb from AMD in the AI Chip Race,125663329,,AMD,InvestorPlace,Looking for stock market analysis and research with proves results? Zacks.com offers in-depth financial research with over 30years of proven results.,https://finnhub.io/api/news?id=bc7966e4eb56e9424e358c1115a349b9b3defbcec39e00ecd2f09ff16784a67a
company,1707368880,Nvidia Stock Is Down. Amazon Will Have to Wait.,125722077,https://images.barrons.com/im-66774762/social,AMD,MarketWatch,The chip maker’s shares were slipping in premarket trading.,https://finnhub.io/api/news?id=a2ff4cc44882531762a35a159ff32c0071d00649ad3fa4b3c8c66709fa4417e9
company,1707368880,The 3 Most Undervalued Stocks to Buy in February 2024,125647458,,AMD,InvestorPlace,Looking for stock market analysis and research with proves results? Zacks.com offers in-depth financial research with over 30years of proven results.,https://finnhub.io/api/news?id=6333df8a901fc9b6ce35c18f2f67982b48a5c2aaa64f7672233756bde56b2c2e
company,1707368880,Nvidia Stock Inches Up. It’s Closing In on Amazon’s Market Value.,125642590,https://images.barrons.com/im-66774762/social,AMD,MarketWatch,Nvidia inches higher Thursday after reaching a new closing high in the previous session. The chip maker is near to overtaking Amazon.com in terms of market...,https://finnhub.io/api/news?id=4700cf23262e60a4a78eaf805a40e37ca96c91160fd5e4bc133bb21b61d91fe5
company,1707366360,The 7 Best AI Stocks to Buy for 100% Returns by 2025,125672972,,AMD,InvestorPlace,Looking for stock market analysis and research with proves results? Zacks.com offers in-depth financial research with over 30years of proven results.,https://finnhub.io/api/news?id=3ea0c9ece0f3ab4d0a7dd66183eedf6d26b730af50df99bcf5baaf530e0bb2c5
company,1707361002,Analyst who predicted Nvidia could eclipse $700 unveils new target,125624691,,AMD,Yahoo,Here's what could happen next to Nvidia shares.,https://finnhub.io/api/news?id=ee59c1b8cc0c50a59aede82b0c519b60920935b21ce799ad443d23efd3cc219f
company,1707359400,3 Stocks to Buy for the New 2024 Bull Market,125720031,,AMD,InvestorPlace,Looking for stock market analysis and research with proves results? Zacks.com offers in-depth financial research with over 30years of proven results.,https://finnhub.io/api/news?id=1f0858fc3212529b5bcdc1cdf19d9c60e528dcd5eac153559441a48f55c3a71c
company,1707358080,NVDA Stock May Pass AMZN in Market Cap. Next Up Could Be GOOGL.,125673437,,AMD,InvestorPlace,Looking for stock market analysis and research with proves results? Zacks.com offers in-depth financial research with over 30years of proven results.,https://finnhub.io/api/news?id=fe058e372897da2c6c330d8a55022452f82543237b035a5a3593c6af50152db9
company,1707515624,11 Best FAANG Stocks To Invest In,125722723,https://s.yimg.com/ny/api/res/1.2/7Gx6spp6_PBhafflJyOgIg--/YXBwaWQ9aGlnaGxhbmRlcjt3PTEyMDA7aD02NzM-/https://media.zenfs.com/en/insidermonkey.com/bea9e08dfcb627e82790c8dcb3f61dd9,AMD,Yahoo,"In this article, we will be taking a look at the 11 best FAANG stocks to invest in. To skip our detailed analysis of the tech industry, you can go directly to see the 5 Best FAANG Stocks To Invest In. From FAANG to the Magnificent 7 and Beyond The technology sector has been on […]",https://finnhub.io/api/news?id=9d9e65a1f98948f72c57c4b8a92e34624bb5637c73a518651931b7b5822e9ee6
company,1707514322,13 Best Big Company Stocks to Buy,125717813,https://media.zenfs.com/en/insidermonkey.com/b9eada651e333e37d7279776c9d21c92,AMD,Yahoo,"In this article, we discuss the 13 best big company stocks to buy. To skip the latest news and analysts’ sentiments around the current economic conditions, go directly to the 5 Best Big Company Stocks to Buy. Despite the doubts, the market performed exceptionally in 2023. While several analysts believed it to be temporary, the […]",https://finnhub.io/api/news?id=5a591d05ddeda5d472d9ae8455a84b2997c9c477049f7535ca4f12a4af08d529
company,1707512861,AMD Stock Today: How To Design A Long Call Calendar Spread Trade In Advanced Micro Devices Options,125774071,https://media.zenfs.com/en/ibd.com/bb2b0124f243e8f09ce5591a7f157af3,AMD,Yahoo,The goal of taking the calendar trade is to gain exposure to profit but to significantly limit loss if we are incorrect.,https://finnhub.io/api/news?id=f0150b32007b58822449680e0ba3823c7630c426bff363808a1530cf62e16c77
company,1707484817,What The Fed Could Do After The Annual CPI Revision,125710053,https://media.gettyimages.com/id/1451320169/photo/young-asian-woman-managing-personal-banking-and-finance-planning-budget-and-calculating.jpg?b=1&s=170667a&w=0&k=20&c=VuUT5CoMn1-ZIuG3Xh7VAOhRtOKlz6AufhzuLXxH22Q=,AMD,SeekingAlpha,"S&P 500 reached a historic milestone of 5000, overshadowing today's CPI revision data. Read why Fed rate hike expectations may be adjusted with the CPI revision.",https://finnhub.io/api/news?id=bd18c067e156122306bd21f0d25d9aa51fc8ce001a4f23d65630171d71a41cde
company,1707477360,Chip Stocks Mixed as US Plans Big R&D Fund,125714671,,AMD,TipRanks,Looking for stock market analysis and research with proves results? Zacks.com offers in-depth financial research with over 30years of proven results.,https://finnhub.io/api/news?id=d5352240ee518c4de87daa9798ac3910d736e269ddbde0e4c4e18f64b35cc005
company,1707477300,4 Reasons to Buy Nvidia Stock Like There's No Tomorrow,125700330,https://g.foolcdn.com/editorial/images/764209/nvidia-headquarters-with-nvidia-sign-in-front.png,AMD,Yahoo,The company is crushing it in AI and is profiting from a recovering PC market.,https://finnhub.io/api/news?id=1d72b13d40ea39eeb08664b1e0b2cf8cf544f000d71b6897fc26a16dd2a65fdf
company,1707476940,Chip stocks rise as Biden unveils $5B CHIPs Act plan to establish R&D consortium (update),125720018,,AMD,Seeking Alpha,Looking for stock market analysis and research with proves results? Zacks.com offers in-depth financial research with over 30years of proven results.,https://finnhub.io/api/news?id=047cf03b34e20e9272e44b28657c393ea6537e82e38f48835148ca621baddcf2
company,1707472800,Most big cryptocurrencies rise as Bitcoin  rallies,125718037,https://images.mktw.net/im-397587/social,AMD,MarketWatch,"Most large cryptocurrencies were up during morning trading on Friday, with Bitcoin seeing the biggest change, rising 3.79% to $47,057.90. Seven additional...",https://finnhub.io/api/news?id=4237fc17ce70e41a28e6302a6c9f1135acc2a94f82addbcaf92ad89611f653e6
company,1707470400,Market Whales and Their Recent Bets on AMD Options,125720020,,AMD,Benzinga,Looking for stock market analysis and research with proves results? Zacks.com offers in-depth financial research with over 30years of proven results.,https://finnhub.io/api/news?id=395d545649cc22948d0bfb27ce71fff774a7a87e6bd653b7370f97ca934227ac
company,1707469440,Bunge Global upgraded at HSBC on stock’s valuation,125712814,,AMD,Seeking Alpha,Looking for stock market analysis and research with proves results? Zacks.com offers in-depth financial research with over 30years of proven results.,https://finnhub.io/api/news?id=5434e75011cc4dadca47f0cb9d9fa2b0ebea4d8c2957cdc4092b0622474f5dd3
company,1707466140,Arm Stock Is the New AI Favorite. 1 Reason to Think Twice Before Buying.,125718163,https://images.barrons.com/im-177611/social,AMD,MarketWatch,Arm Holdings is now firmly among the hottest artificial-intelligence stocks in the U.S. market.,https://finnhub.io/api/news?id=723df70483a0fc28e0d0926a2d20480cb88378c18c4f534add5651f65288af81
company,1707457200,Can Arm’s earnings ever justify its huge stock price surge?,125716333,,AMD,MarketWatch,Looking for stock market analysis and research with proves results? Zacks.com offers in-depth financial research with over 30years of proven results.,https://finnhub.io/api/news?id=9ea5a6c58ca12b80a5d752fa11f2462c9690985be7a7cffd443bac94fa38e2f9
company,1707454500,"Nvidia Stock Gains, but the AI Hype Is Shifting Elsewhere",125722071,https://images.barrons.com/im-21851742/social,AMD,MarketWatch,The chip maker's rally is leveling out slightly as other stocks related to artificial intelligence take the spotlight.,https://finnhub.io/api/news?id=2512b6238cdd276aa9f0da92a305e938c2ff72b3b41ca56861969502f182379a
company,1707445440,Chip Stocks Mixed as U.S. Plans Big R&D Fund,125720026,,AMD,TipRanks,Looking for stock market analysis and research with proves results? Zacks.com offers in-depth financial research with over 30years of proven results.,https://finnhub.io/api/news?id=b770c4784aa27cec137664eba8aa6b29710ff746e5d42ed6b1099acd4bf9a724
company,1707602361,"How I Would Invest $1,000,000 And Live Of Dividends Forever",125765342,,AMD,SeekingAlpha,,https://finnhub.io/api/news?id=33d2238a3425af24f42e5a471471204817c336320ceb08d7d92dd51aeead966b
company,1707571800,Best AI Stocks 2024: AMD Stock vs. Super Micro Computer Stock,125761484,https://g.foolcdn.com/editorial/images/764592/stock-market-person-studying-computer.jpg,AMD,Yahoo,"AMD and Super Micro Computer are both excellent companies, but only one can be the best AI stock to buy today.",https://finnhub.io/api/news?id=75c2672b74fc55cbc6aaccf5a2e59b3644aaeac9bf6b290ea42ea2f043b5b873
company,1707570300,3 Artificial Intelligence (AI) Stocks That Are Screaming Buys in February,125747359,https://g.foolcdn.com/editorial/images/764090/artificial-intelligence-ai-on-circuit-board.jpg,AMD,Yahoo,Not all AI stocks have become overpriced.,https://finnhub.io/api/news?id=81ab818c8cd4c3b844dd34b3dd2a97deddce8556ea48aa217a9f69689023027c
company,1707567000,Better Artificial Intelligence (AI) Stock: Super Micro Computer vs. AMD,125761489,https://g.foolcdn.com/editorial/images/763954/chatbot-smartphone-person.jpg,AMD,Yahoo,Investors have an easy choice to make if they want to pick just one of these two AI stocks right now.,https://finnhub.io/api/news?id=f153a73e367fe67da7a6a37585006351e0889a4b4ea2c3427e6baa00f63f7ff6
company,1707566580,‘Keep on Buying AMD Stock’: Top Analyst Predicts Over 20% Market Share in AI GPU Market,125766285,,AMD,TipRanks,Looking for stock market analysis and research with proves results? Zacks.com offers in-depth financial research with over 30years of proven results.,https://finnhub.io/api/news?id=763dee63cfff18117a630584472a8eb5e3bc8cd15f050e17667760d8cbd1042f
company,1707564171,12 Best NASDAQ Stocks To Buy In 2024,125747364,https://media.zenfs.com/en/insidermonkey.com/7bccf1845e2d3cc33d5cf6ac7b385a2a,AMD,Yahoo,"In this article, we discuss 12 best NASDAQ stocks to buy in 2024. If you want to skip our discussion on the stock market and NASDAQ’s performance, head over to 5 Best NASDAQ Stocks To Buy In 2024. In December 2023, the performance of the 106 tracked indexes was predominantly positive, with only five finishing […]",https://finnhub.io/api/news?id=252b1bf47e12e0e4ff8f7e0b812db31cc3e25d8bffda3befe331e192be4c7e79
company,1707562260,Artificial Intelligence (AI) Could Make Semiconductors a $1 Trillion Market by 2030: Here Are 3 Top Stocks to Buy Now,125745080,https://g.foolcdn.com/editorial/images/764377/computer-chip-engineer.jpg,AMD,Yahoo,These stocks can help investors profit from rapid growth in the AI chip market.,https://finnhub.io/api/news?id=bc3f0833fe7dacbee980687ee4703b38a591513afb40b35a9a6623eaa723e4ae
company,1707561300,AMD Poised to Win Over 20% of the AI GPU Market: Top Analyst,125766286,,AMD,TipRanks,Looking for stock market analysis and research with proves results? Zacks.com offers in-depth financial research with over 30years of proven results.,https://finnhub.io/api/news?id=a6d2e3eaee25422ccce8c76815e5d32bc71ebd01b625d24c215334ca779a6bf7
company,1707684684,AMD: Ready To Conquer The AI Boom,125790642,https://static.seekingalpha.com/cdn/s3/uploads/getty_images/1464561797/image_1464561797.jpg?io=getty-c-w1536,AMD,SeekingAlpha,AMD offers a strong product portfolio within AI and is perfectly positioned to benefit from the AI market. Read what makes AMD stock a real bargain.,https://finnhub.io/api/news?id=c462bff8e692c6c592ff673b56879ac71143c0a54434017e4f9b4b2e60512136
company,1707681600,AMD: Progress Over Perfection,125789593,https://media.gettyimages.com/id/1567063913/photo/in-this-photo-illustration-an-amd-logo-seen-displayed-on-a-smartphone-with-stock-market.jpg?b=1&s=594x594&w=0&k=20&c=0Un36Bk8VlXURftnj0zvcupCsmCfSj7NyEA52BCr_so=,AMD,SeekingAlpha,"AMD has had a big run, but the chip stock has more upside considering current consensus estimates are far too low. Read more about AMD stock here.",https://finnhub.io/api/news?id=b8fe2711e770b3fc88bc11745dcaee06317ed54ec7df48c64d373b3ca9bd2ab4
company,1707662220,Straight From the CEO's Mouth: How 3 Innovators Are Shaping the Future of AI,125779511,https://g.foolcdn.com/editorial/images/764695/megaphone-and-crowd.jpg,AMD,Yahoo,"Witness the AI revolution as it unfolds, with these three tech giants in the vanguard. Check out the visionary insights their CEOs shared about the future of AI in their latest earnings calls.",https://finnhub.io/api/news?id=bb76bd8a4d7749a232edfed4a576659d0d79a5ace81f80d17df77b545b7cdd42
company,1707659054,14 Best US Stocks For Foreign Investors,125777755,https://media.zenfs.com/en/insidermonkey.com/77e89059d6aa8a2911ecad49e586d221,AMD,Yahoo,"In this article, we discuss the 14 best US stocks for foreign investors. If you want to read about some more US stocks that foreigners should consider for their portfolios, go directly to the 5 Best US Stocks For Foreign Investors. Late last year, investors flocked to Treasuries amid expectations of rate cuts by the […]",https://finnhub.io/api/news?id=3033c1f2b60887650cbcc573295d74444e89f638c49af00d672176af79dbaa85
company,1707650700,Jackson Peak Capital Q4 2023 Update,125778723,https://static.seekingalpha.com/cdn/s3/uploads/getty_images/1488294044/image_1488294044.jpg?io=getty-c-w1536,AMD,SeekingAlpha,"Q4 2023 was a strong quarter for Jackson Peak, which returned +12.0% gross / +9.9% net. Click here to read the full fund letter.",https://finnhub.io/api/news?id=7c2fee4ca9803dad002a382e7dab9aef9cd880dee4ac4752ccf5c1581bfd896d
company,1707650280,"After Meta debuts a dividend, Goldman does the math if big names follow suit",125780265,,AMD,Seeking Alpha,Looking for stock market analysis and research with proves results? Zacks.com offers in-depth financial research with over 30years of proven results.,https://finnhub.io/api/news?id=67bc4f45ee23dab175e9410436550e56e23c758b1539fe8c9aa68ab62b1e059b
company,1707642000,Semiconductor ETFs Look Well Poised Post Q4 Earnings,125778230,,AMD,TalkMarkets,Looking for stock market analysis and research with proves results? Zacks.com offers in-depth financial research with over 30years of proven results.,https://finnhub.io/api/news?id=c689fb51c6ae905b3ee284b1ab5dd0746c639784cbe5af166234f566cb3749ff
company,1707638400,These Top 15 Semiconductor Stocks Up 18% YTD,125790767,,AMD,TalkMarkets,Looking for stock market analysis and research with proves results? Zacks.com offers in-depth financial research with over 30years of proven results.,https://finnhub.io/api/news?id=bc644008ba687fa0b77ef5da79a118043e3c4944852b4b0c555b80f223c69393
company,1707618120,3 Strong Buy VR Stocks to Add to Your February Must-Watch List,125788702,,AMD,InvestorPlace,Looking for stock market analysis and research with proves results? Zacks.com offers in-depth financial research with over 30years of proven results.,https://finnhub.io/api/news?id=5f7d22fa43966958f0992905f086c44dfa53d73c2a28137af00d2b3d83df87f6
company,1707775833,3 Alternative Picks if You Love Super Micro Computer Stock,125966126,https://media.zenfs.com/en/investorplace_417/ccec34825e02804ceafa9b4b737b027f,AMD,Yahoo,"If you love the concept undergirding information technology (IT) stalwart Super Micro Computer (NASDAQ:SMCI) – and who doesn’t? – but just don’t want to pay “full retail,” then Super Micro Computer alternative picks may be right for you. These are ideas similar or related to SMCI stock in some tangible way but with arguably better entry points. Fundamentally, investors gravitate toward the IT specialist because it’s one of the largest producers of high-performance, high-efficiency servers. As a",https://finnhub.io/api/news?id=f9331b153a0db135330cee570ad0b49bd9eff643345e41fcdc1dd8967993b9ea
company,1707770155,Nvidia: Strong Market Growth Enables It For 15% Annual Returns,125816393,https://media.gettyimages.com/id/1730512586/photo/the-logo-of-nvidia-is-seen-during-the-hon-hai-tech-day-in-taipei-on-october-18-2023.jpg?b=1&s=594x594&w=0&k=20&c=euQbL59kd03W1e09HfVxCMei1WIaMFeJvmoNY7Az7Fc=,AMD,SeekingAlpha,"Nvidia's stock price has surged 61.75% and is no longer undervalued, but with minimal downside risk, it holds a buy rating. Click for my NVDA update.",https://finnhub.io/api/news?id=aaf36ef82d681938bd14d90f7a7736a6072fc760704f3eeff248a209f6fb49f1
company,1707762420,Tech Down as AI Speculation Cools -- Tech Roundup,125880435,https://mw3.wsj.net/mw5/content/logos/mw_logo_social.png,AMD,MarketWatch,Shares of technology companies slipped as AI speculation cooled in some niches. AI darlings Microsoft and Advanced Micro Devices fell slightly. On the other...,https://finnhub.io/api/news?id=d0348ff0ca04a053b321f5781f141b5f3e2fce9ca22a77a5b98a31f1b0454999
company,1707758678,13 Best Metaverse Stocks To Buy Right Now,125805643,https://media.zenfs.com/en/insidermonkey.com/2f4eecc4b2656346f2dd4effc4027a39,AMD,Yahoo,"In this article, we discuss 13 best metaverse stocks to buy now. If you want to skip our detailed discussion on the metaverse, head directly to 5 Best Metaverse Stocks To Buy Right Now. The global metaverse market was valued at $98.7 billion in 2023, and it is anticipated to grow significantly, reaching $1,402.5 billion […]",https://finnhub.io/api/news?id=7bd0ce97639220222c52fd6286b6729f9be68f6cc779a560fc226c0fda1942e7
company,1707752292,Downgrading AMD Stock: Don't Blindly Chase A Parabolic Run,125808405,https://static.seekingalpha.com/cdn/s3/uploads/getty_images/1220627489/image_1220627489.jpg?io=getty-c-w1536,AMD,SeekingAlpha,"Advanced Micro Devices earnings are growing and justify a higher share price, but no stock/sector can run forever. Read more to see our analysis on AMD stock.",https://finnhub.io/api/news?id=79dca424e9044bb42ebf6bad1e7f10a402e533f64288c751a56bd2bb5a70bac0
company,1707749038,Analyst reveals new Broadcom stock price target tied to AI,125811163,,AMD,Yahoo,AI surge is crucial to what happens to Broadcom stock next.,https://finnhub.io/api/news?id=bf570667a777915ea3b1ae6d8af5896722fdf4c8da645c99400d75d62244a2c9
company,1707747907,Should Investors Buy AMD Stock Instead of Palantir Stock?,125805889,https://g.foolcdn.com/editorial/images/764933/gettyimages-625756386.jpg,AMD,Yahoo,AMD and Palantir are excellent companies that are capitalizing on artificial intelligence.,https://finnhub.io/api/news?id=35b16947102e073662a42a3699e2192c76bdaca98c08f8836e8521a6f1cdb644
company,1707735900,"Nvidia Is Now Worth More Than Berkshire Hathaway, Tesla, and AMD Combined. But Will It Last?",125799449,https://g.foolcdn.com/editorial/images/764533/gettyimages-1219240238-1200x800-5b2df79-1.jpg,AMD,Yahoo,Last year's best-performing S&P 500 stock isn't ready to pass the baton.,https://finnhub.io/api/news?id=f02c50aa8aaf1180f5924f9d4e8158a1af6bb8986a664789ad580890378396cb
company,1707732000,Large cryptocurrencies mixed as Polygon climbs,125808689,https://images.mktw.net/im-397587/social,AMD,MarketWatch,"Large cryptocurrencies were mixed during morning trading on Monday, with Uniswap seeing the biggest move, falling 1.93% to $6.60. Polygon lead the increases...",https://finnhub.io/api/news?id=d0b653e5792ec080ecc92d000679a57aa642fde970e8e5f3605259fee300e20e
company,1707731569,AMD Stock Might Have Climbed Too Fast Again: Valuation Update,125799798,https://media.gettyimages.com/id/1829065293/photo/lisa-su-chair-and-chief-executive-officer-of-advanced-micro-devices-inc-during-a-bloomberg.jpg?b=1&s=594x594&w=0&k=20&c=6FP4LcAfXhPbTZx0ekaO7Vt-1kVuDdjy_ExMRtrkp2c=,AMD,SeekingAlpha,"Advanced Micro Devices, Inc.'s stock trajectory follows a cyclical pattern, with periods of growth and corrections. Click for my AMD stock update.",https://finnhub.io/api/news?id=4d941c9a9d8ee5064c8d06b6501d6882bee981b72948b0b0c2bae166f936f74e
company,1707718620,7 Tech Stocks to Buy on the Dip: February 2024,125800173,,AMD,InvestorPlace,Looking for stock market analysis and research with proves results? Zacks.com offers in-depth financial research with over 30years of proven results.,https://finnhub.io/api/news?id=13854b80ecf8b74d031a4270c8cfbb98a71833dbe092f5e0c4de77c5df7e8ae4
company,1707715980,"An inflection point for the winning momentum trade is near, says top technical analyst",125800174,,AMD,MarketWatch,Looking for stock market analysis and research with proves results? Zacks.com offers in-depth financial research with over 30years of proven results.,https://finnhub.io/api/news?id=b41648ee58fc36d79b5ff829bf0ba06ca8528850d61ddfb324b256afea3f6d90
company,1707714840,Will AMD Stock Skyrocket in 2024? 4 Catalysts to Watch.,125800175,,AMD,InvestorPlace,Looking for stock market analysis and research with proves results? Zacks.com offers in-depth financial research with over 30years of proven results.,https://finnhub.io/api/news?id=dd5bf6c0604267ce5cb8d5b7927ec71baca3e7c60493684fb51741a9d2bf2284
company,1707714360,Nvidia Stock Rises. Here’s How Much CEO Huang Expects to Be Spent on AI.,125810188,https://images.barrons.com/im-97828699/social,AMD,MarketWatch,Nvidia CEO Jensen Huang predicts spending on data centers will double in the next few years in order to support artificial-intelligence technology.,https://finnhub.io/api/news?id=71651608feaa26fa773d6179774257dd5b34c7fb9328380315481947137c4ad9
company,1707706440,"Fly Insider: Jasper, AMD among week's notable insider trades",125812806,,AMD,Thefly.com,Looking for stock market analysis and research with proves results? Zacks.com offers in-depth financial research with over 30years of proven results.,https://finnhub.io/api/news?id=29afec361deb3d29b925fd8aebde494997d105557a2df89e03457146f08de1ca
company,1707844025,AI Stocks Pull Back After Steep Climb. Microsoft Copilot Reviews Are Mixed.,125835428,https://media.zenfs.com/en/ibd.com/6bce3f531dc6e942d4eb54043dcbd783,AMD,Yahoo,Investors might be getting altitude sickness from the stratospheric climbs of artificial intelligence chipmakers and other AI stocks.,https://finnhub.io/api/news?id=04437da91ef0471c6a6afe18832c4c446d58bc704c97a0bd8872aa4d3539c92e
company,1707859288,The 3 Most Promising Semiconductor Stocks for AI Investors to Consider,125981986,https://media.zenfs.com/en/investorplace_417/e91252d73998b916157956077018b8b7,AMD,Yahoo,"Artificial intelligence (AI) has become a buzzword in the stock market after companies specializing in the industry saw robust growth. Many corporations announced efforts to use AI and generative AI to increase their productivity and enhance their products. AI remains in its early innings. Its tools are showing up in more places, offering investors an attractive opportunity. Various AI tools need semiconductors to operate. Semiconductor firms have even offered chips exclusively for artificial in",https://finnhub.io/api/news?id=975ffea3445801f23ee0837f28b0668f7eadc8ca44c2e72a6959f7502a8237cc
