category,datetime,headline,id,image,related,source,summary,url
company,1704119406,Is Advanced Micro (AMD) a Buy as Wall Street Analysts Look Optimistic?,124800579,https://media.zenfs.com/en/zacks.com/090f58c1efbe3555b861102525e50b39,AMD,Yahoo,"The average brokerage recommendation (ABR) for Advanced Micro (AMD) is equivalent to a Buy. The overly optimistic recommendations of Wall Street analysts make the effectiveness of this highly sought-after metric questionable. So, is it worth buying the stock?",https://finnhub.io/api/news?id=5d012a8257dc6707c98cb52d6c8306b124b041f29794eaf005e6c83b1b5aceb2
company,1704119100,"2 Reasons to Buy AMD, and 1 Reason to Sell",124796715,https://g.foolcdn.com/editorial/images/759470/two-people-use-ipad.jpg,AMD,Yahoo,"The company has massive potential in AI, but the stock might be too expensive for now.",https://finnhub.io/api/news?id=bdd89dda3566dd364d24fbb15fb8bea935967b97bc8be83a8a8d2ab685aeccfc
company,1704097800,Top 5 Stocks To Consider Avoiding As We Begin 2024,124794062,https://static.seekingalpha.com/cdn/s3/uploads/getty_images/1411239127/image_1411239127.jpg?io=getty-c-w1536,AMD,SeekingAlpha,"S&P 500 outperformed Wall Street strategists' bearish prognostications, finishing the year up 25%. Find out top 5 stocks to avoid buying at current levels.",https://finnhub.io/api/news?id=4f5987918b422345804cee2061cd402a67ffe2bf51a098f161897ea4d2ad95fe
company,1704095940,2024’s Power Players: 7 Stocks Racing to a Trillion Valuation,124794932,,AMD,InvestorPlace,Looking for stock market analysis and research with proves results? Zacks.com offers in-depth financial research with over 30years of proven results.,https://finnhub.io/api/news?id=0fe6ae0b94b85aaf8f46a00a01189522f1871ca042a4a167e5f605965a58e8d1
company,1704090480,"XLI: S&P 500 Technology ETF soars in 2023; Nvidia, Uber, AMD top gainers",124807119,,AMD,Seeking Alpha,Looking for stock market analysis and research with proves results? Zacks.com offers in-depth financial research with over 30years of proven results.,https://finnhub.io/api/news?id=aba540359bdf62655a6843881a434ca942113d57ff957048b6a1abba51830908
company,1704082920,7 Megatrend Stocks to Buy for a Mighty Start to 2024,124798815,,AMD,InvestorPlace,Looking for stock market analysis and research with proves results? Zacks.com offers in-depth financial research with over 30years of proven results.,https://finnhub.io/api/news?id=eee2eef3a729c9a59997788823b74320d41f7385adb558f20168ca2e8f99ea13
company,1704077520,CLoud Stocks: Analysis of AMD’s Acquisitions,124813908,,AMD,TalkMarkets,Looking for stock market analysis and research with proves results? Zacks.com offers in-depth financial research with over 30years of proven results.,https://finnhub.io/api/news?id=d8d4ac41a59a89fc1687e09eaac57b89aaccd602be38999025c39bfb5f592cab
company,1704074340,Do AMD’s Huge Opportunities Outweigh Its Significant Threats?,124813909,,AMD,InvestorPlace,Looking for stock market analysis and research with proves results? Zacks.com offers in-depth financial research with over 30years of proven results.,https://finnhub.io/api/news?id=147d2697450c2724dd7c2d002c048984db1acece9dd204dd1ab87ab040452360
company,1704237000,2023's Biggest Winners In The Russell 1000,124820229,https://static.seekingalpha.com/cdn/s3/uploads/getty_images/1477505250/image_1477505250.jpg?io=getty-c-w1536,AMD,SeekingAlpha,"We noted how there was a somewhat elevated share of the S&P 500 experiencing gains of over 100%. Expanding to the Russell 1000, there were 34 stocks with total returns of more than 100%",https://finnhub.io/api/news?id=070865b935eb485c35bb8a489b498183aa4d9b5ec3cf0ea238b92fec1ae9c78d
company,1704235860,AMD Stock Sank Today -- Is It a Buy for 2024?,124820926,https://g.foolcdn.com/editorial/images/759954/a-question-mark-made-of-hundred-dollar-bills.jpg,AMD,Yahoo,AMD stock tumbled in 2024's first trading day as big news surrounding Apple and ASML triggered a rise in bearish momentum for the tech sector.,https://finnhub.io/api/news?id=3109b5f6a813549a4d0bd83eef98aede9f29cd62fb4455474e5f154133228933
company,1704219970,"Chip Stocks, ETFs Notch Big Losses",124820927,https://media.zenfs.com/en/Barrons.com/12ea0f43d8f8307249a68d1cb2e0587e,AMD,Yahoo,"Stocks of semiconductor-related companies were testing investor patience on Tuesday. After marking a 45% gain in 2023, the Invesco Semiconductors ETF was down 3.3% mid-afternoon. The iShares Semiconductor ETF also was down.",https://finnhub.io/api/news?id=11ed2e2ca9c6432d5ce8a009d7d30327bbdfa1c516bf8664aceef8252ac2bd4b
company,1704219755,Why AMD (AMD) Shares Are Sliding Today,124810151,https://s.yimg.com/ny/api/res/1.2/CF_jp.YgwUr5daOVP6AyYg--/YXBwaWQ9aGlnaGxhbmRlcjt3PTEyMDA7aD02MDA-/https://media.zenfs.com/en/stockstory_922/d8e71fcf83a5154bb9a363113758de33,AMD,Yahoo,"Shares of computer processor maker AMD (NASDAQ:AMD) fell 5.8% in the morning session after the Nasdaq and S&P 500 continued to retreat while the Dow rose slightly. Interest rates rebounded a bit, and investors may be continuing to take profits after a strong calendar 2023. Other than that, we found nothing more specific for the broad move downward. As a reminder, 2023 was a stellar year for the markets, with the S&P 500 surging by almost 25% and the NASDAQ Composite up over 40%. The final month",https://finnhub.io/api/news?id=7a426fe3b723b17a17853b08a7530db27ca1b67110f8fc255474964d7d4c9f41
company,1704213300,"Advanced Micro Devices Inc. stock falls Tuesday, underperforms market",124955010,https://images.mktw.net/im-220105/social,AMD,MarketWatch,"Shares of Advanced Micro Devices Inc. shed 5.99% to $138.58 Tuesday, on what proved to be an all-around mixed trading session for the stock market, with the...",https://finnhub.io/api/news?id=accdd28b78695068e6d1a264e4e20fde2a664c54458c73e2c0ccdd1f74c97dc4
company,1704213030,3 Artificial Intelligence (AI) Stocks to Buy Hand Over Fist in January,124806321,https://g.foolcdn.com/editorial/images/759761/ai-possibilities.jpg,AMD,Yahoo,These companies have massive potential in AI over the next year and look too good to pass up.,https://finnhub.io/api/news?id=c5b46f6edb658088179d9da63c3b87e9a62867aab3fbfa32da17dcd1d80fed83
company,1704212075,AI PCs Could Spur Upgrade Cycle In 2024,124805942,https://media.zenfs.com/en/ibd.com/eca4f76d218dc2e54964c460c1b25ec6,AMD,Yahoo,Artificial intelligence capabilities are coming to personal computers in the year ahead thanks to new PC processors from AMD and Intel.,https://finnhub.io/api/news?id=b727fd7b99e1f00bbbf14fe4eab9bd8f3684c6ba0a50c6a7769abff0ba12fe67
company,1704206160,"Chip sector suffers unanimous selloff, led by stocks of AMD, Intel and ASML",124813568,https://s.wsj.net/public/resources/MWimages/MW-GP644_MicroS_ZG_20180906154215.jpg,AMD,MarketWatch,"The semiconductor sector was suffering a unanimous selloff to start 2024, the day after posting the best yearly gain in 20 years. The VanEck Semiconductor...",https://finnhub.io/api/news?id=837a39ac64511357b0a3b7bfe9961ee8b91669b210131a255d660584f12ac51c
company,1704200400,2 Artificial Intelligence (AI) Stocks to Buy Before the Nasdaq Surges in 2024,124805943,https://g.foolcdn.com/editorial/images/759335/investor-looks-at-a-financial-chart-on-a-laptop.jpg,AMD,Yahoo,Improving investor sentiment can drive these AI stocks higher in 2024.,https://finnhub.io/api/news?id=b0c4f1e69b77a43bdbd222928f91a9f608f5e9a8479f25c42071355de9223142
company,1704199800,"2023's Biggest Winners In The Russell 1,000",124812473,,AMD,TalkMarkets,Looking for stock market analysis and research with proves results? Zacks.com offers in-depth financial research with over 30years of proven results.,https://finnhub.io/api/news?id=f1ad602640bee27733174931b240fb420ca4638dec108cf1783358e828709c96
company,1704199200,"Video: Nasdaq 100 Movers: AMD, MRNA",124813885,,AMD,Market News Video,Looking for stock market analysis and research with proves results? Zacks.com offers in-depth financial research with over 30years of proven results.,https://finnhub.io/api/news?id=aa1bb507a333032c466a9b305a24a1246b2a824ea486f90da1e356c10434d492
company,1704197700,Nvidia Is Incredible. These 3 Chip Stocks Could Beat It in 2024.,124803988,https://g.foolcdn.com/editorial/images/759722/silicon-wafers-and-microcircuits-with-automation-system-control-application-semiconductor.jpg,AMD,Yahoo,The rising AI tide could lift more boats next year.,https://finnhub.io/api/news?id=c5adc42c5311d2c9e80871a693dd04e80a74b9313833e0b07227f698f99ed946
company,1704197220,3 Catalysts That Could Take AMD Stock to New Highs in 2024,124813448,,AMD,InvestorPlace,Looking for stock market analysis and research with proves results? Zacks.com offers in-depth financial research with over 30years of proven results.,https://finnhub.io/api/news?id=9d6d769f6901c8038eee98ea57688cd0db688aa24748afd2ca7869c16ab28313
company,1704196800,1 Company That Could Be Worth $1 Trillion by 2028,124805948,https://g.foolcdn.com/editorial/images/756413/amd-stock-investing-money.jpg,AMD,Yahoo,Exactly how big is 1 trillion?,https://finnhub.io/api/news?id=c0ed2522b7d8c5fd487dc4c8ed38ffab04a532ffbd077301c029dfde3683c5a0
company,1704194520,Tech Stalls As Rising Bond Yields Spook Investors,124809861,,AMD,TalkMarkets,Looking for stock market analysis and research with proves results? Zacks.com offers in-depth financial research with over 30years of proven results.,https://finnhub.io/api/news?id=83176dc80a161dfc73d2209fea1a1084fbeaad723a8ce956364d35315f9baf4f
company,1704192300,2 Top Artificial Intelligence (AI) Stocks That Could Go Parabolic in 2024,124802670,https://g.foolcdn.com/editorial/images/759726/gettyimages-1358049777.jpg,AMD,Yahoo,Nvidia and AMD might be the best way to bet on the long-term AI opportunity in the new year and beyond.,https://finnhub.io/api/news?id=6635ab52ce916652aecefec6b221492da1788bed65a6aab328265b11b826f69d
company,1704190440,"Semiconductor Stocks Tumble, Wiping Out $100 Billion Amid US-China Trade Tensions: Rocky Start To 2024",124806398,,AMD,Benzinga,Looking for stock market analysis and research with proves results? Zacks.com offers in-depth financial research with over 30years of proven results.,https://finnhub.io/api/news?id=46af28bb3902af56414cf85c182eef56451555e87c0b152c7020c15de690909f
company,1704190140,"Apple, Microsoft among Magnificent 7 smacked as rates rise to start 2024",124809267,,AMD,Seeking Alpha,Looking for stock market analysis and research with proves results? Zacks.com offers in-depth financial research with over 30years of proven results.,https://finnhub.io/api/news?id=fe4c828b0429f7c98ca5d5a1d1b00536f8c2025e3fc04743cf6aead28eca1f0b
company,1704189780,Investigating Advanced Micro Devices's Standing In Semiconductors & Semiconductor Equipment Industry Compared To Competitors,124813891,,AMD,Benzinga,Looking for stock market analysis and research with proves results? Zacks.com offers in-depth financial research with over 30years of proven results.,https://finnhub.io/api/news?id=23e95d5551a09a4cc95b30217ede49a7369ae26b3cccc81a9908d3c5501c9807
company,1704189600,Large cryptocurrencies mixed as Bitcoin rises,124813571,https://images.mktw.net/im-397587/social,AMD,MarketWatch,"Large cryptocurrencies were mixed during morning trading on Tuesday, with Bitcoin seeing the biggest move, rising 3.80% to $45,265.20. Uniswap led the...",https://finnhub.io/api/news?id=61c5221c870eb2b7e02427abde3fbc10b3617f68823f133e4ba03076c36e88f2
company,1704183060,Why Are Nvidia And AMD Stock Trading Lower Tuesday?,124813466,,AMD,Benzinga,Looking for stock market analysis and research with proves results? Zacks.com offers in-depth financial research with over 30years of proven results.,https://finnhub.io/api/news?id=f2c091140bdbee37a21f4805f314d9f7a13d78ab26a623e947708b57d402cf22
company,1704181200,ASML Hit by Block on Chinese Exports. What It Means for Chip Stocks.,124813570,https://images.barrons.com/im-207753/social,AMD,MarketWatch,It’s a sign that U.S.-led efforts to freeze out China from global chip-supply chains are bearing fruit.,https://finnhub.io/api/news?id=8623446b078cbe8ebd40b5f7d1e75d240bc2de42a2449d6c1df4fccaed6dea65
company,1704175980,"AMD price target raised by $25 at Stifel, here's why",124813893,,AMD,Thefly.com,Looking for stock market analysis and research with proves results? Zacks.com offers in-depth financial research with over 30years of proven results.,https://finnhub.io/api/news?id=a316c4b48e952c0c3fad0c576d5b0a751491b3b01a0d6190e58ff0b2fca8de66
company,1704173700,"ASML stock dips after Netherlands' move to curb some exports to China, Beijing criticizes - report",124805552,,AMD,Seeking Alpha,Looking for stock market analysis and research with proves results? Zacks.com offers in-depth financial research with over 30years of proven results.,https://finnhub.io/api/news?id=35bf03af083542498390e80c7e2e3a432686bff75d18795ffc9f242ce1ad5b98
company,1704170580,"ASML stock dips after Netherlands' move to curb some exports to China, Beijing criticises - report",124805553,,AMD,Seeking Alpha,Looking for stock market analysis and research with proves results? Zacks.com offers in-depth financial research with over 30years of proven results.,https://finnhub.io/api/news?id=2324373112d7a4b070e4b4116ba5b989949f224c72dda09878efa7acd2e6e265
company,1704169320,These Major AI Performers In 2023 Have More Room To Run In 2024,124816955,,AMD,TalkMarkets,Looking for stock market analysis and research with proves results? Zacks.com offers in-depth financial research with over 30years of proven results.,https://finnhub.io/api/news?id=c3ad979d0e3795308eb399151d0e44f0010c416054b93fe56f1790cb1d4ad747
company,1704169200,China criticizes Netherlands' actions to curb some ASML's exports - report,124805555,,AMD,Seeking Alpha,Looking for stock market analysis and research with proves results? Zacks.com offers in-depth financial research with over 30years of proven results.,https://finnhub.io/api/news?id=07dd1d9c19804851abfe615c182accf8be8ad9bdb682a8bd403a643d4258d10a
company,1704169080,The Year That Was: Analyzing 2023’s Top Performing Stocks and Sectors,124805833,,AMD,InvestorPlace,Looking for stock market analysis and research with proves results? Zacks.com offers in-depth financial research with over 30years of proven results.,https://finnhub.io/api/news?id=85b94be0b14781761f249b3382483f35f5bb015d9620d639db0a8d0ad5764b34
company,1704168000,Is Modern AI The Legacy Of Quake? This Machine Learning Expert Thinks So,124813480,,AMD,Benzinga,Looking for stock market analysis and research with proves results? Zacks.com offers in-depth financial research with over 30years of proven results.,https://finnhub.io/api/news?id=6c9312bcc228c0940227cfba6e11ad987fcd12792d76d8270da39272ebb2f5d8
company,1704164820,"Market Today: Tech Stocks Tumble as Bond Yields Rise, Alibaba Repurchases Shares",124813484,,AMD,GuruFocus,Looking for stock market analysis and research with proves results? Zacks.com offers in-depth financial research with over 30years of proven results.,https://finnhub.io/api/news?id=d6ec2d5f722c53193dfd1b344ea7de61bc3b23afd7096678b28c46f33840e114
company,1704164400,10 Best Stock Traders In Congress In 2023 (Spoiler: Nancy Pelosi Has Reentered The Chat),124813334,,AMD,Benzinga,Looking for stock market analysis and research with proves results? Zacks.com offers in-depth financial research with over 30years of proven results.,https://finnhub.io/api/news?id=308f33f052a198ee04b8006102a98edb0d66cd57c2cd2ebd04a6abfb48e0fef4
company,1704164100,10 Best Stock Traders In Congress In 2023 (Spoiler: Nancy Pelosi Is Back On The List),124813335,,AMD,Benzinga,Looking for stock market analysis and research with proves results? Zacks.com offers in-depth financial research with over 30years of proven results.,https://finnhub.io/api/news?id=fbf33727c49a9dbd7965b5ac4e09e1cfb76fdfce54ca78cb22cd7e792de64c1b
company,1704163320,"Why did ARM Holdings and AMD stock go down today? Blame tech sell off, politics",124813487,,AMD,Seeking Alpha,Looking for stock market analysis and research with proves results? Zacks.com offers in-depth financial research with over 30years of proven results.,https://finnhub.io/api/news?id=6fb2136fa5c4e7ef0911b04d7cd54b067662cafdb42b4ae830cf530b950b0839
company,1704161880,"Notable Tuesday Option Activity: AMD, AEO, AYX",124813903,,AMD,Stock Options Channel,Looking for stock market analysis and research with proves results? Zacks.com offers in-depth financial research with over 30years of proven results.,https://finnhub.io/api/news?id=1fc057103c25d073088a6a842a333b6a0d50df27300277a8fcb7f04d11c517c2
company,1704159120,"Tuesday Sector Laggards: Technology & Communications, Industrial",124813905,,AMD,Market News Video,Looking for stock market analysis and research with proves results? Zacks.com offers in-depth financial research with over 30years of proven results.,https://finnhub.io/api/news?id=05944c3f1e54e91b51ac55ec950cdfc602654eb6f33f76ccb79f5aff8cc06b30
company,1704311683,"From AI to flying cars, here’s what to expect at CES 2024",124831899,https://s.yimg.com/ny/api/res/1.2/0NSO0cJaO7CGHNXrdlQOdw--/YXBwaWQ9aGlnaGxhbmRlcjt3PTEyMDA7aD04MDA-/https://s.yimg.com/os/creatr-uploaded-images/2024-01/1cf3fed0-aa67-11ee-bf47-f8602df25587,AMD,Yahoo,"CES 2024 is just around the corner, and that means you can expect a slew of announcements for everything from new TVs to flying cars.",https://finnhub.io/api/news?id=dfdc9ce5d6c3c80aec38e6e1dc554431885695e80027cc45a0de863c59ea67b9
company,1704299700,Advanced Micro Devices Inc. stock underperforms Wednesday when compared to competitors,124955006,https://images.mktw.net/im-220105/social,AMD,MarketWatch,"Shares of Advanced Micro Devices Inc. shed 2.35% to $135.32 Wednesday, on what proved to be an all-around grim trading session for the stock market, with the...",https://finnhub.io/api/news?id=1e7d4f43080bc86015eade54383d4e96a04880bf5fb93a0afb8fba61c33cd11b
company,1704290411,"Advanced Micro Devices, Inc. (AMD) Is a Trending Stock: Facts to Know Before Betting on It",124829672,https://media.zenfs.com/en/zacks.com/48ad4265c55e3ba7a1fb9148d6e717d9,AMD,Yahoo,"Advanced Micro (AMD) has been one of the stocks most watched by Zacks.com users lately. So, it is worth exploring what lies ahead for the stock.",https://finnhub.io/api/news?id=13d24e5e9cf039920c41a317cef370fbfe6de84da7fcc8522b6e6c72cae8dbc5
company,1704286920,Better Artificial Intelligence (AI) Stock: AMD vs. Microsoft,124829673,https://g.foolcdn.com/editorial/images/759808/investing-tablet-wall-street-suit-stocks-finance.jpg,AMD,Yahoo,"The AI market is booming, and these companies are excellent ways to profit from the industry over the long term.",https://finnhub.io/api/news?id=b282b1e5ce46d923cc51be7f94da1629a2324580fa569ea9a809e78fa8e91a9b
company,1704286440,"3 Stocks to Buy for the $100,000 Portfolio: 2024 Edition",124839541,,AMD,InvestorPlace,Looking for stock market analysis and research with proves results? Zacks.com offers in-depth financial research with over 30years of proven results.,https://finnhub.io/api/news?id=35d975180edb0053d5a8f33e22d21f6a76265ba48409d235227481c7225d0aa7
company,1704286440,"Micron top chip pick at Wells Fargo; firm likes Nvidia, AMD at current levels",124834017,,AMD,Seeking Alpha,Looking for stock market analysis and research with proves results? Zacks.com offers in-depth financial research with over 30years of proven results.,https://finnhub.io/api/news?id=e10bdb00cf503de7a138cc0b5648b2f2b95ee0a5eed7cdb37489604fff0b3365
company,1704282994,12 Best Artificial Intelligence Stocks To Buy for 2024 According to Financial Media,124825352,https://s.yimg.com/ny/api/res/1.2/uhaEWqILUdrMhtlWPKv7tg--/YXBwaWQ9aGlnaGxhbmRlcjt3PTEyMDA7aD04MDA-/https://media.zenfs.com/en/insidermonkey.com/048a910fa376a41ea682f5f73e8c3d95,AMD,Yahoo,"This article examines the 12 best artificial intelligence stocks to buy for 2024 according to financial media. If you want to skip our detailed analysis of these stocks, go directly to the 5 Best Artificial Intelligence Stocks To Buy for 2024 According to Financial Media. Tech stocks had a great time in 2023, with about […]",https://finnhub.io/api/news?id=494f8503d0403f2b80ef443d7790f4334b759726042fe361e7b243e3204732fb
company,1704282960,Reddit Stocks: 3 r/WallStreetBets Favorites That Are Actually Good Buys,124832473,,AMD,InvestorPlace,Looking for stock market analysis and research with proves results? Zacks.com offers in-depth financial research with over 30years of proven results.,https://finnhub.io/api/news?id=779e885a04efa7429c1bbfebd4accbcac585a473828830697aee85fcd6ea5ed5
company,1704281948,"Arm Holdings: It's A Buy, But Not At This Price",124827531,https://static.seekingalpha.com/cdn/s3/uploads/getty_images/1680492055/image_1680492055.jpg?io=getty-c-w1536,AMD,SeekingAlpha,Arm Holdings plc experienced volatility in its stock price. Is ARM stock a good value at current levels? Check out my view of that.,https://finnhub.io/api/news?id=80b2e6bf6c53db58536f65cd3ed28039e13837c046fb9f54e906aefb4d95d41e
company,1704281820,10 Information Technology Stocks With Whale Alerts In Today's Session,124832474,,AMD,Benzinga,Looking for stock market analysis and research with proves results? Zacks.com offers in-depth financial research with over 30years of proven results.,https://finnhub.io/api/news?id=f65b35b9682f866171c14aa107ac547cfd38b876d9af9be1ded4ed05be780953
company,1704281100,"AI's 2024 Reality Check: Facing 'Peak AI Hype,' It's Time To Prove Its Worth",124828525,,AMD,Benzinga,Looking for stock market analysis and research with proves results? Zacks.com offers in-depth financial research with over 30years of proven results.,https://finnhub.io/api/news?id=905fc29f67c809f25d63b57abb08dc5f486701ecc03b585ae6f1ef93eead2054
company,1704280500,Chip Stocks Are the Best Way to Play AI This Year. Here’s Why.,124835015,https://images.barrons.com/im-391203/social,AMD,MarketWatch,UBS raised their 2027 revenue estimate for the AI industry by 40%.,https://finnhub.io/api/news?id=132430988f0951a27d486ecb87489a22039cdf4b406e935d6701991509facf8a
company,1704280440,Can AMD Stock Reach $170? Here’s What Stifel Expects,124839545,,AMD,TipRanks,Looking for stock market analysis and research with proves results? Zacks.com offers in-depth financial research with over 30years of proven results.,https://finnhub.io/api/news?id=366a25c70acff25bafea692e62c35a4ba2a44bfe79c87be218cb721fd0321a14
company,1704280260,"Chip stocks dive again, with SOX falling for a 4th straight session after closing at a record high",124861555,https://s.wsj.net/public/resources/MWimages/MW-GP644_MicroS_ZG_20180906154215.jpg,AMD,MarketWatch,"The semiconductor sector was suffering another broad selloff, and was headed for a fourth straight loss after a stellar 2023. The PHLX Semiconductor Index...",https://finnhub.io/api/news?id=c05766e8c9f4bfabea09b281726523f52367b2ad7a1d368e98f817916839bc6b
company,1704276600,3 Top Gaming Stocks to Buy in January,124824014,https://g.foolcdn.com/editorial/images/759779/gamer-pc-video-games.jpg,AMD,Yahoo,These companies have powerful positions in the video game industry and could see big gains over the long term.,https://finnhub.io/api/news?id=889956c9a1f635459d535694901623fc1b2dac6f45712a5ba105997bd64796c4
company,1704276000,Large cryptocurrencies fall as Polygon plunges,124835102,https://images.mktw.net/im-397587/social,AMD,MarketWatch,"All large cryptocurrencies were down during morning trading on Wednesday, with Polygon seeing the biggest move, tumbling 14.16% to 84 cents. Dogecoin tumbled...",https://finnhub.io/api/news?id=dcd00e8e4f7e56d656ebf75c13694a5f3a7a0db42dab025a996bcfdbbc64259b
company,1704272040,Why Are Nvidia And AMD Stock Trading Lower Wednesday?,124827181,,AMD,Benzinga,Looking for stock market analysis and research with proves results? Zacks.com offers in-depth financial research with over 30years of proven results.,https://finnhub.io/api/news?id=955ca11dfe5280a305243c460b10513ecb48862c291ce06997bf31e8fd38b9fa
company,1704270300,A Glitch In The Rally? Cruise Operators And Chip Stocks Targeted In Profit Taking,124827222,,AMD,Benzinga,Looking for stock market analysis and research with proves results? Zacks.com offers in-depth financial research with over 30years of proven results.,https://finnhub.io/api/news?id=0120ed02e7404ff3f02bd1ad6e017d215c06792ddfd880c0ed4ab341563e754e
company,1704268380,"US Chip Giants AMD, NVIDIA, Qualcomm Start 2024 With Decline After Stellar Performance Last Year",124839550,,AMD,Benzinga,Looking for stock market analysis and research with proves results? Zacks.com offers in-depth financial research with over 30years of proven results.,https://finnhub.io/api/news?id=40e7f3ec7b0ab8c547fb20fc1a0ef8a045ce83b857d144a16d6589d8588a9501
company,1704265860,Nasdaq 100 Alert: 7 Undervalued Tech Stocks Ready to Rocket in 2024,124826616,,AMD,InvestorPlace,Looking for stock market analysis and research with proves results? Zacks.com offers in-depth financial research with over 30years of proven results.,https://finnhub.io/api/news?id=5fff1ac7e71522059c52910e7c7f35f8859893eb8ee03f13527359a6c7ed67f4
company,1704265080,Advanced Micro Devices (AMD) Receives a Rating Update from a Top Analyst,124839552,,AMD,TipRanks,Looking for stock market analysis and research with proves results? Zacks.com offers in-depth financial research with over 30years of proven results.,https://finnhub.io/api/news?id=354cae311c1a1ebe4a35a4e0c401bec38c7d5ac7a8696bb405def5c1cc94c2ab
company,1704259522,AIQ: Positioned For Strong Gains Next Year If You Like AI,124823366,https://static.seekingalpha.com/cdn/s3/uploads/getty_images/1488457074/image_1488457074.jpg?io=getty-c-w1536,AMD,SeekingAlpha,The Global X Artificial Intelligence & Technology Fund is well-positioned to benefit from the continued optimism for AI in 2024. See what makes AIQ ETF a Buy.,https://finnhub.io/api/news?id=67b7880f00eca47062e4c911450a8fa9ff7d65af5b945194adae0df01b752692
