category,datetime,headline,id,image,related,source,summary,url
company,1709524920,AMD names Thomas Zacharia to expand strategic AI relationships,126338283,,AMD,Thefly.com,Looking for stock market analysis and research with proves results? Zacks.com offers in-depth financial research with over 30years of proven results.,https://finnhub.io/api/news?id=551893c26bc959bff895cfc6c7baf954267b7d4a2b0388865a84ef2667d8c77c
company,1709517840,Analysts Offer Insights on Technology Companies: Marqeta (MQ) and Advanced Micro Devices (AMD),126300238,,AMD,TipRanks,Looking for stock market analysis and research with proves results? Zacks.com offers in-depth financial research with over 30years of proven results.,https://finnhub.io/api/news?id=48dfd467201dcc743c55dd9301746382605cf392951f0acfcdb2a207bd350661
company,1709514360,"If I Were You, I Would Buy These 3 Stocks Right Now",126305501,,AMD,InvestorPlace,Looking for stock market analysis and research with proves results? Zacks.com offers in-depth financial research with over 30years of proven results.,https://finnhub.io/api/news?id=9a5a5d7050c29f86d8fa468bead07ab98c0ae563095c1c8afee46c43a29adcda
company,1709677091,"Advanced Micro Devices, Inc. (AMD) Morgan Stanley Technology, Media & Telecom Conference (Transcript)",126343653,https://static.seekingalpha.com/assets/og_image_1200-29b2bfe1a595477db6826bd2126c63ac2091efb7ec76347a8e7f81ba17e3de6c.png,AMD,SeekingAlpha,"Advanced Micro Devices, Inc. (NASDAQ:NASDAQ:AMD) Morgan Stanley Technology, Media &amp; Telecom Conference March 5, 2024 11:00 AM ETCompany...",https://finnhub.io/api/news?id=1001bcf67373c25a357dcbc603f3f21a08b6b89ec5483e015b37ecefe7da37de
company,1709666966,YouTube and Facebook hit by mass tech outage,126334395,https://s.yimg.com/ny/api/res/1.2/tX9OSnn8mWMFM5X5u_qlLw--/YXBwaWQ9aGlnaGxhbmRlcjt3PTEyMDA7aD03NTA-/https://media.zenfs.com/en/the_telegraph_818/2c37978c9b8887dfb777743d89ca54c4,AMD,Yahoo,"Users of YouTube and Facebook experienced disruption this afternoon, with hundreds of thousands of users reporting problems.",https://finnhub.io/api/news?id=5e99fe2c647f7afa4a37cfa9f3225a23b0db60e96d0ce482ff356847bd16b3f0
company,1709663369,Why SoundHound AI Stock Is Plummeting Again Today,126337181,https://g.foolcdn.com/editorial/images/768120/an-arrow-moving-down-above-chart-lines.jpg,AMD,Yahoo,"Following a recent pullback, SoundHound AI stock is now down roughly 33% from its 52-week high.",https://finnhub.io/api/news?id=a89cb2ce24b3dd25e0d8ed14de32a9c884681eae65d065ea8924947204b20ab4
company,1709661637,Taiwan Semiconductor Raising Prices 8.7% In 2024 As Revenue Growth Underperforms Customers,126339720,https://static.seekingalpha.com/cdn/s3/uploads/getty_images/1357288205/image_1357288205.jpg?io=getty-c-w1536,AMD,SeekingAlpha,"TSMC, a leading semiconductor foundry, is witnessing underperformance in revenue and share price, and it plans to increase chip prices in 2024. Learn more on TSM stock here.",https://finnhub.io/api/news?id=93926c727e663b22fa8c5bc403f849289b7c2706899eb0a936c2a02c6ec113b0
company,1709660050,Why Super Micro Computer Stock Is Falling Today,126332128,https://g.foolcdn.com/editorial/images/768089/ai-on-a-chip.jpg,AMD,Yahoo,"Following news about AMD's exports to China, Supermicro and other AI stocks are tumbling today.",https://finnhub.io/api/news?id=e0322f481eac8a51d430e2fe370004924ceedb72572c90e6074e2bcccdc94696
company,1709659529,Qualcomm CEO touts company's generative AI opportunity during annual shareholder meeting,126332129,https://s.yimg.com/ny/api/res/1.2/ZdYduLI7ijWPv8RrFghv5A--/YXBwaWQ9aGlnaGxhbmRlcjt3PTEyMDA7aD04MDA-/https://s.yimg.com/os/creatr-uploaded-images/2024-02/adefeb20-db12-11ee-9ebb-1afad868aa6d,AMD,Yahoo,Qualcomm CEO Cristiano Amon took the stage during the company's annual,https://finnhub.io/api/news?id=ba2dfcafe852464834358095b51001a9303213111871de0d31a12339907b3fe5
company,1709656255,Nvidia: Supply Growth Not Keeping Pace With Demand,126337477,,AMD,SeekingAlpha,,https://finnhub.io/api/news?id=76fd28c6c987cdd6a3dd07e144a818366c295d8792eb880d9f76e698266e5a61
company,1709655420,NEW YORK MARKET CLOSE: Stocks slide as Apple and Tesla pull tech lower,126338239,,AMD,Alliance News,Looking for stock market analysis and research with proves results? Zacks.com offers in-depth financial research with over 30years of proven results.,https://finnhub.io/api/news?id=df5897311034d58f0f64356a1535ee5951ab9441daf8f487daa8b51a768f1910
company,1709652005,1 Wall Street Analyst Thinks AMD Stock Is Going to $235. Is It a Buy Around $204?,126332130,https://g.foolcdn.com/editorial/images/768078/gettyimages-1550670587.jpg,AMD,Yahoo,AMD is now up 150% over the last year. Can investors still score wins with the explosive AI stock?,https://finnhub.io/api/news?id=a2f255eaa8850a40bf4b29c1292c8d175558692bdd222e31f1b13a066ccc4419
company,1709600931,AMD Hits US Roadblock in Selling AI Chip Tailored for China,126321772,https://s.yimg.com/ny/api/res/1.2/Nn2QbS1oEfa6vUYqlSsn5Q--/YXBwaWQ9aGlnaGxhbmRlcjt3PTEyMDA7aD04MDA-/https://media.zenfs.com/en/bloomberg_technology_68/8e9514b7be376ebe432e15ea833651ff,AMD,Yahoo,"(Bloomberg) -- Advanced Micro Devices Inc. hit a US government roadblock in attempting to sell an artificial intelligence chip tailored for the Chinese market, according to people familiar with the matter, part of Washington’s crackdown on the export of advanced technologies to the country.Most Read from BloombergAmerica Blew Almost $2 Trillion. Make It Stop.Supreme Court Rules Trump Can Appear on Presidential BallotsWall Street’s DEI Retreat Has Officially BegunChina Scraps Premier Li's Briefin",https://finnhub.io/api/news?id=3ab8805a71afd83d2e2da1e10dc41ecac962ced2803b37a740a8827c7a536b1d
company,1709647200,AMD Extends Market-Leading FPGA Portfolio with AMD Spartan UltraScale+ Family Built for Cost-Sensitive Edge Applications,126332132,https://s.yimg.com/ny/api/res/1.2/bWmbOFgxo2Tc75pD8zXwTQ--/YXBwaWQ9aGlnaGxhbmRlcjt3PTEyMDA7aD02NzU-/https://media.zenfs.com/en/globenewswire.com/48053bc8566d39b42e2a6842af5c43dc,AMD,Yahoo,"AMD Spartan UltraScale+ FPGA An aerial view of the AMD Spartan UltraScale+ FPGA. — New FPGAs offer high I/O counts, power efficiency, and state-of-the-art security features for embedded vision, healthcare, industrial networking, robotics, and video applications — SANTA CLARA, Calif., March 05, 2024 (GLOBE NEWSWIRE) -- AMD (NASDAQ: AMD) today announced the AMD Spartan™ UltraScale+™ FPGA family, the newest addition to the extensive portfolio of AMD Cost-Optimized FPGAs and adaptive SoCs. Deliverin",https://finnhub.io/api/news?id=445347825739bab9f30ca0edb1b02ccf403d12c3cef7618f4e5a7ae1d1e7e98b
company,1709647069,US STOCKS-Wall St set for lower open as megacaps slide ahead of economic data,126328596,https://s.yimg.com/cv/apiv2/social/images/yahoo_default_logo-1200x1200.png,AMD,Yahoo,"Wall Street was set to open lower on Tuesday as megacap stocks were under pressure ahead of a slew of economic data and several key events this week, including appearances from Federal Reserve Chair Jerome Powell.  An AI-fueled rally on Wall Street ran out of steam at the start of this week as focus turns to fresh cues on the Fed's monetary policy path after signs of sticky inflation in February dampened hopes of early interest rate cuts.",https://finnhub.io/api/news?id=61b74b21a47d68a38e3c9463fff1821210f37409a45dc04e9a5da670a9e766bb
company,1709641260,EXCLUSIVE: TrueMark Investment CEO Reveals Strategy To Beat Markets With Actively Managed ETFs,126332400,,AMD,Benzinga,Looking for stock market analysis and research with proves results? Zacks.com offers in-depth financial research with over 30years of proven results.,https://finnhub.io/api/news?id=c7c8ff66dfb5e8c4a09a7c429398821071ba237c0be527f54019eb92be67ad0b
company,1709641175,US STOCKS-Futures retreat as megacaps slide ahead of economic data,126332134,https://s.yimg.com/cv/apiv2/social/images/yahoo_default_logo-1200x1200.png,AMD,Yahoo,"U.S. stock index futures dipped on Tuesday as investors awaited a slew of economic data and several key events this week, including appearances from Federal Reserve Chair Jerome Powell.  The benchmark S&P 500 hit a fresh intraday record high on Monday before closing slightly lower in the run up to Powell's testimony before lawmakers on Wednesday and Thursday.  ""In this testimony, Powell will likely ask for more patience regarding the timing of the first rate cut, he will probably say that inflation is on the right path but that they don't want to lower their guard too early,"" said Ipek Ozkardeskaya, a senior market analyst at Swissquote Bank.",https://finnhub.io/api/news?id=96b2a98200e3fe25b7870205427a75b4168bf4ad229c32a64d290537d72fe138
company,1709637000,Chip Champ? Here Are 3 Reasons to Buy AMD Stock Right Now.,126337716,,AMD,InvestorPlace,Looking for stock market analysis and research with proves results? Zacks.com offers in-depth financial research with over 30years of proven results.,https://finnhub.io/api/news?id=3c6bf882da64cac1849c4a0b1b7b451b420747be0d1d2385781eef59240ce824
company,1709636861,"MORNING BID AMERICAS-Apple angst, Tesla tanks, Bitcoin balks",126332135,https://s.yimg.com/cv/apiv2/social/images/yahoo_default_logo-1200x1200.png,AMD,Yahoo,"A look at the day ahead in U.S. and global markets from Mike Dolan Has the ""Magnificent Seven"" become the ""Famous Five"" or even ""Fab Four""?  With one eye on the major macro events of the week, Apple and Tesla's separation from this year's tech-infused stock market buoyancy and their underperformance against the other ""Magnificent Seven"" megacaps has become more pointed.  Apple's stock was down almost 2% again ahead of Tuesday's bell after news that iPhone sales in China fell 24% year-on-year in the first six weeks of 2024 - as the U.S. giant faces increased competition from domestic rivals such as Huawei .",https://finnhub.io/api/news?id=ab84a409285673497f3140cc5dd7d0c4b2c7c8ed9ed122ee61237a39e14fb215
company,1709636400,Keysight and AMD Break Barriers to Redefine Benchmarking for Cloud and Edge Infrastructure Performance,126338244,,AMD,Business Wire,Looking for stock market analysis and research with proves results? Zacks.com offers in-depth financial research with over 30years of proven results.,https://finnhub.io/api/news?id=b62b6cb965e80440075116edb311a87970653b53823a3260fce36a68292fc9ba
company,1709635800,Is Broadcom an Artificial Intelligence (AI) Stock to Buy Hand Over Fist Before Its Big News on Thursday?,126328308,https://g.foolcdn.com/editorial/images/767825/computer-chip-engineer.jpg,AMD,Yahoo,This semiconductor and infrastructure software company has been a big winner thanks to the generative AI boom.,https://finnhub.io/api/news?id=6623a03a8d1cd34d39d03ace9e65733dec9436edefaf767c71d2ee93c2a5dde8
company,1709635500,Is AMD Stock a Buy?,126326406,https://g.foolcdn.com/editorial/images/767555/headquarters-with-amd-logo-on-building_amd_advance.jpg,AMD,Yahoo,Earnings-per-share estimates indicate AMD's stock price could nearly double over the next two years.,https://finnhub.io/api/news?id=59cbad3fee881eca6b898d8b0a0193c29958ed62edc7b078f754eac225dc65a3
company,1709634000,"Prudent Investors Watching Semiconductors For Sign Of A Pullback, Gold Hits All Time High",126329078,,AMD,Benzinga,Looking for stock market analysis and research with proves results? Zacks.com offers in-depth financial research with over 30years of proven results.,https://finnhub.io/api/news?id=68f521dbdadea265bb760852d439e30c09a10f1bdecc22894bba67ea6eca09f5
company,1709633907,"US STOCKS-Futures ease ahead of economic data, megacap growth stocks slide",126332138,https://s.yimg.com/cv/apiv2/social/images/yahoo_default_logo-1200x1200.png,AMD,Yahoo,"U.S. stock index futures dipped on Tuesday as investors awaited a slew of economic data and several key events this week, including appearances from Federal Reserve Chair Jerome Powell.  The benchmark S&P 500 hit a fresh intraday record high on Monday before closing slightly lower as investor focus turned to Powell's testimony before lawmakers on Wednesday and Thursday that could offer more cues on the Fed's monetary policy path.  ""In this testimony, Powell will likely ask for more patience regarding the timing of the first rate cut, he will probably say that inflation is on the right path but that they don’t want to lower their guard too early,"" said Ipek Ozkardeskaya, a senior market analyst at Swissquote Bank.",https://finnhub.io/api/news?id=4cb49e3c144d22cbb80afcba20cfa37cd6580192b53886eab84c2bb6c2ddf391
company,1709632800,"Most big cryptocurrencies climb on Dogecoin, Ethereum increases",126345708,https://images.mktw.net/im-397587/social,AMD,MarketWatch,"Most large cryptocurrencies were up during morning trading on Tuesday, with Dogecoin seeing the biggest move, rising 6.38% to 19 cents. Six additional...",https://finnhub.io/api/news?id=652fcab0e2e418ca3bc6e5fca4e1b1cec31a36603e30840410f2571b14ea6fd9
company,1709632800,Rare Stock Picks In February 2024 - From 32 Discerning Analysts,126327682,https://static.seekingalpha.com/uploads/2024/3/4/saupload_needle_in_haystack.png,AMD,SeekingAlpha,"In our monthly Rare Stock Picks series, we're highlighting February 2024 investment picks. Click here for the list of February 2024 Buy recommendations.",https://finnhub.io/api/news?id=91b81d253568f76c0be29bf4b9e12b23b1dccefa2e20a0af1da40adb0997c5a8
company,1709631960,"The Nvidia Paradox: Skyrocketing Now, But for How Long?",126329359,,AMD,InvestorPlace,Looking for stock market analysis and research with proves results? Zacks.com offers in-depth financial research with over 30years of proven results.,https://finnhub.io/api/news?id=e1bf27e6e92b8828e87d888843cc89758e6894cbc5243e69a3a523012917b70f
company,1709631574,"Nvidia: Seeing Growth Near-Term (Upgrade), Doubling Down On Skepticism Long-Term",126327431,https://static.seekingalpha.com/cdn/s3/uploads/getty_images/1494623409/image_1494623409.jpg?io=getty-c-w1536,AMD,SeekingAlpha,"NVIDIA Corporation's strong financial performance and high demand give a bullish outlook, but potential risks and competition remain. Learn more on NVDA stock here.",https://finnhub.io/api/news?id=883bd4968e70e7edacff7369593cc9bc62131cdaae252490438f11b3bcde2e3c
company,1709631000,"Tech Bulls Talk AI, Nvidia, Cloud Computing, And A 'Year For The Record Books'",126327309,https://static.seekingalpha.com/cdn/s3/uploads/getty_images/1304628896/image_1304628896.jpg?io=getty-c-w750,AMD,SeekingAlpha,"Dan Ives from Wedbush Securities and Keith Fitz-Gerald from Fitz-Gerald Group share their views on AI, Nvidia, cloud computing, how Big Tech can get bigger and why that's good for markets.",https://finnhub.io/api/news?id=f7a00307158beff1d209f01e9118f2b05569a00a6c202f4eba486e036b7ad26a
company,1709629500,"Dell Just Gave Nvidia and AMD Investors Something to Cheer -- and Amazon, Microsoft, and Google Investors Something to Perhaps Fear",126322220,https://g.foolcdn.com/editorial/images/767830/surprised-young-woman-laptop.jpg,AMD,Yahoo,Dell's COO seemed to undermine a key thesis about the growth prospects for the major cloud services providers.,https://finnhub.io/api/news?id=cac4e5a98d0d3d9d024a04101c80006956f4d0eb77b3c23374c54812dca09312
company,1709626320,AMD extends FPGA portfolio with AMD Spartan UltraScale+ family,126338251,,AMD,Thefly.com,Looking for stock market analysis and research with proves results? Zacks.com offers in-depth financial research with over 30years of proven results.,https://finnhub.io/api/news?id=7027f5bb748a21571150272ae22bc800326d7199ce72cb77a8c5dc6453150720
company,1709624460,"Apple, AMD And February Services PMIs",126332570,,AMD,TalkMarkets,Looking for stock market analysis and research with proves results? Zacks.com offers in-depth financial research with over 30years of proven results.,https://finnhub.io/api/news?id=bf289e3f18188c80be614c786cff7a22e97643a2f76a97ced6d46ed1f585f9c2
company,1709624460,AMD’s (NASDAQ:AMD) China Focused AI Chip Hits Roadblock,126338252,,AMD,TipRanks,Looking for stock market analysis and research with proves results? Zacks.com offers in-depth financial research with over 30years of proven results.,https://finnhub.io/api/news?id=56158b41aadd10326b47f700e9b4d8d7c3c51f593ad8a2097672f14c0c474fbd
company,1709617500,"AMD will need export license for made-for-China chips, Bloomberg reports",126338254,,AMD,Thefly.com,Looking for stock market analysis and research with proves results? Zacks.com offers in-depth financial research with over 30years of proven results.,https://finnhub.io/api/news?id=8ce3455ed1d95bbdcc1f3f3274c13fadac8c3b41fb8c960e8dba95de5b36f9e7
company,1709616300,Buy Alert: AMD Stock Is on Fire and Bound to Go Even Higher,126337738,,AMD,InvestorPlace,Looking for stock market analysis and research with proves results? Zacks.com offers in-depth financial research with over 30years of proven results.,https://finnhub.io/api/news?id=d30e6710d46d9f7c83ad946a2a0d07c9aecf6fb547eb5ff3914e56c6571af720
company,1709615340,"Jim Cramer Picks These 4 Stocks As Better AI Investments Alongside Nvidia, Skips Super Micro Computer",126330457,,AMD,Benzinga,Looking for stock market analysis and research with proves results? Zacks.com offers in-depth financial research with over 30years of proven results.,https://finnhub.io/api/news?id=1fb01c161207d6d94714f0d58fe960eb10c00e3339ca239b021fdde1f4bd391d
company,1709614920,Taiwan Semiconductor (TSMC) Raising Prices 8.7% In 2024 As Revenue Growth Underperforms Customers,126363997,,AMD,Seeking Alpha,Looking for stock market analysis and research with proves results? Zacks.com offers in-depth financial research with over 30years of proven results.,https://finnhub.io/api/news?id=81a044d35229f7606a3e7ec51faa5e158cca03c8641be28acc434670d750c5e7
company,1709614380,Nvidia Stock Falls. Why It’s Still Time to Consider the Bubble Question.,126323181,https://images.barrons.com/im-46873410/social,AMD,MarketWatch,"The AI chip maker surpassed Saudi Aramco to become the world's third most valuable company Monday, behind Microsoft and Apple.",https://finnhub.io/api/news?id=e95fd2cf8e6d81481bbf285cc31e9c231e29aff0ed6a5ba21c952a6aa0767dda
company,1709612700,AMD faces regulatory snag in attempts to sell China-specific AI chip: report,126338260,,AMD,Seeking Alpha,Looking for stock market analysis and research with proves results? Zacks.com offers in-depth financial research with over 30years of proven results.,https://finnhub.io/api/news?id=aee2a43191e45a7a2094bf1a8ba2a918ae05cf25bbaa07c4278199ed232e9c31
company,1709608860,What You Missed On Wall Street On Tuesday,126337303,,AMD,Thefly.com,Looking for stock market analysis and research with proves results? Zacks.com offers in-depth financial research with over 30years of proven results.,https://finnhub.io/api/news?id=72403634fc905ea80fb81dc997f03fcc7f9d141a051dae74218c99a3e97a05a4
company,1709605026,"UPDATE 1-AMD hits US roadblock in selling AI chip tailored for China, Bloomberg News reports",126322221,https://s.yimg.com/cv/apiv2/social/images/yahoo_default_logo-1200x1200.png,AMD,Yahoo,"Advanced Micro Devices hit a U.S. government roadblock in its efforts to sell an artificial intelligence chip tailored for the Chinese market, as part of Washington's crackdown on the export of advanced technologies to the country, Bloomberg News reported on Monday.  AMD tried to gain a go-ahead from the U.S. Commerce Department to sell the AI processor to China.  The chip has lower performance than what AMD sells outside of China, and was designed to meet U.S. export restrictions, the report added, citing people familiar with the matter.",https://finnhub.io/api/news?id=f1c646cf03d9f674921c20fc1823f4659d8db07eb9a95f2b2cf2f5e390055d54
company,1709602738,"AMD hits US roadblock in selling AI chip tailored for China, Bloomberg News reports",126322222,https://media.zenfs.com/en/reuters-finance.com/fc65c5f0d1ce508a8b00314b9d3f84b4,AMD,Yahoo,"AMD tried to gain a go-ahead from the U.S. Commerce Department to sell the AI processor to China.  The chip has lower performance than what AMD sells outside of China, and was designed to meet U.S. export restrictions, the report added, citing people familiar with the matter.  U.S. officials said the processor is still too powerful and that the company must obtain a license from Commerce's Bureau of Industry and Security to sell it in China, according to the report.",https://finnhub.io/api/news?id=f065c1cf2c115a14552f6736b58095ed2c16ff7357186d11f0d7536f87736239
company,1709602620,7 Stocks Analysts Are Predicting Will Grow 30% This Year,126335830,,AMD,InvestorPlace,Looking for stock market analysis and research with proves results? Zacks.com offers in-depth financial research with over 30years of proven results.,https://finnhub.io/api/news?id=f4cf2bf9fcd0e190506c99263ef04428f01665b1a84ac83d77468b33a10363c4
company,1709596980,AMD stock analyst sets surprising new price target,126318681,,AMD,Yahoo,Here's what could happen to AMD shares next.,https://finnhub.io/api/news?id=5af3251fd54a542fbba2312af573f93583af49aedf337f483922cca138639bde
company,1709753460,6 Stocks to Buy—When the Market Finally Drops,126362839,https://s.yimg.com/ny/api/res/1.2/ajLP891qd8zt2MiHa2NrQw--/YXBwaWQ9aGlnaGxhbmRlcjt3PTEyMDA7aD02MDA-/https://media.zenfs.com/en/Barrons.com/131e5d3dcd3ef9c0e673eabb06b7e672,AMD,Yahoo,"Five—  Uber Technologies Lam Research Applied Materials Nvidia  and  Advanced Micro Devices  —are on the watch list of Jason Ware, Albion Financial Group’s chief investment officer.  The sixth,  Amphenol  is the choice of Roy Leckie, executive director at Walter Scott and Partners, which owns the stock.  Advanced Micro Devices: The company makes chips for data centers, a fast-growing segment because of high business demand for AI-powered cloud services.",https://finnhub.io/api/news?id=beb9e383329cabb6e3347d2b29edc579c93fd7a197ac1ddd7e7ce16631c9834b
company,1709751600,Coinbase and AMD Count as Value Stocks in Some ETFs,126363097,https://s.yimg.com/ny/api/res/1.2/fybmPn3.hhDwjPk0DLs_Rw--/YXBwaWQ9aGlnaGxhbmRlcjt3PTEyMDA7aD02MDA-/https://media.zenfs.com/en/Barrons.com/982622958aa52616156a0fe13ac57d05,AMD,Yahoo,Value investing has been left behind as the tech-led market rally rages on. A peek at the iShares Russell 1000 Value exchange-traded fund reveals surprises.,https://finnhub.io/api/news?id=8504e59e7efe172a76127045504ed1c7cc1e643f74f6d7989d30038cda739225
company,1709746630,Tech Up as AI Bubble Regains Steam -- Tech Roundup,126365556,,AMD,Finnhub,"Shares of technology companies rose as a speculative bubble in artificial-intelligence issues resumed its inflation. Shares of Nvidia rose by more than 3%, bringing its gains for the...",https://finnhub.io/api/news?id=cb21ce2b618f5b60f44fb95b1e19e3d1513101711eabde162f5f73d0f2c34dd9
company,1709745901,"Why AMD, TSMC, and Broadcom Stocks Are All Up Today",126360385,https://g.foolcdn.com/editorial/images/768270/1-blue-semiconductor-computer-chip.jpg,AMD,Yahoo,"All three of these semiconductor stocks are expensive, but one looks much cheaper than the others.",https://finnhub.io/api/news?id=2e68a48c9fba25149d1018728ca609b183e075d1bea6efdf6587c4d2a67bd9a7
company,1709739420,Keysight (KEYS) Boosts Cloud and Edge Infrastructure Evolution,126361748,,AMD,Yahoo,Keysight (KEYS) partners with AMD to develop a next-generation testing methodology that can efficiently evaluate mobile and 5G private network performance with millions of concurrent devices.,https://finnhub.io/api/news?id=acf1f3194920d2f19173d4468e205cb5f4db757d378177aaadb92b5238e2595b
company,1709728380,Magnificent 7 Price Targets: What Each of These Stocks Could Be Worth in 2030,126360061,,AMD,InvestorPlace,Looking for stock market analysis and research with proves results? Zacks.com offers in-depth financial research with over 30years of proven results.,https://finnhub.io/api/news?id=ce2f04da8a214e75fc835b42a702fa0ba338f399001c4e61c134974ddd029238
company,1709727420,Trillion-Dollar Threshold: The Next 3 Stocks Ready to Rise,126361070,,AMD,InvestorPlace,Looking for stock market analysis and research with proves results? Zacks.com offers in-depth financial research with over 30years of proven results.,https://finnhub.io/api/news?id=9d944b36db9ac6cec174c6a4f7ac88d33aba60ba4c0e4ebb9156bf68bb6c7427
company,1709726400,Is This The End Of The Big Tech Rally?,126355104,,AMD,TalkMarkets,Looking for stock market analysis and research with proves results? Zacks.com offers in-depth financial research with over 30years of proven results.,https://finnhub.io/api/news?id=aa2817b7228bc216a6f58790d299bd8c51d6fedf687a5541438411100ef976ef
company,1709723040,Semis In Uncharted Territory,126357603,,AMD,TalkMarkets,Looking for stock market analysis and research with proves results? Zacks.com offers in-depth financial research with over 30years of proven results.,https://finnhub.io/api/news?id=383b5396d966cc2d9bcda7ffe70919961c092ce024728b08df6726bedf4683e5
company,1709722500,Director Joseph Householder Sells Shares of Advanced Micro Devices Inc (AMD),126381899,,AMD,GuruFocus,Looking for stock market analysis and research with proves results? Zacks.com offers in-depth financial research with over 30years of proven results.,https://finnhub.io/api/news?id=72e2ec1343fc2a3a2747380eb36eaa35248a233547142c8b99a7fe14744020a5
company,1709718120,The Top 3 Quantum Computing Stocks to Buy in March 2024,126356181,,AMD,InvestorPlace,Looking for stock market analysis and research with proves results? Zacks.com offers in-depth financial research with over 30years of proven results.,https://finnhub.io/api/news?id=3d75c067a97b3bdb43e9896a5d91207e54f5f0b4f262713a01b00272cdea3f26
